id,text
[035700 (1224)],"    Ða se eadga wer ageaf ondsware leofum æfter longre hwile, swa he late meahte, elnes oncyðig, oreþe gewealdan: Hwæt, þu me, wine min, wordum nægest, fusne frignest, þæs þe ic furþum ær æfre on ealdre ængum ne wolde monna ofer moldan melda weorðan, þegne on þeode, butan þe nu ða, þy læs þæt wundredan weras ond idesa, ond on geað gutan, gieddum mænden bi me lifgendum."
[035800 (1234)],"    Huru, ic nolde sylf þurh gielpcwide gæstes mines frofre gelettan, ne fæder mines æfre geæfnan, æbylg godes."
[035900 (1238)],"    Symle me onsende sigedryhten min, folca feorhgiefa, siþþan ic furþum ongon on þone æfteran anseld bugan geargemearces, gæst haligne, engel ufancundne, se mec efna gehwam, meahtig meotudes þegn, ond on morgne eft, sigorfæst gesohte, ond me sara gehwylc gehælde hygesorge, ond me in hreþre bileac wuldres wilboda wisdomes giefe micle monigfealdran þonne ænig mon wite in <life> her, þe me alyfed nis to gecyþenne cwicra ængum on foldwege fira cynnes, þæt me ne meahte monna ænig bideaglian hwæt he dearninga on hyge hogde heortan geþoncum, siþþan he me fore eagum onsyne wearð."
[036000 (1255)],    A ic on mode mað monna gehwylcne þeodnes þrymcyme oð þisne dæg.
[036100 (1257)],"    Leofast monna, nu ic for lufan þinre, ond geferscype þæt wit fyrn mid unc longe læstan, nelle ic lætan þe æfre unrotne æfter ealdorlege meðne modseocne minre geweorðan, soden sorgwælmum."
[036200 (1262)],    A ic sibbe wiþ þe healdan wille.
[036300 (1263)],    Nu of hreþerlocan to þam soþan gefean sawel fundað.
[036400 (1265)],"    Nis seo tid latu, tydrað þis banfæt, greothord gnornað, gæst hine fyseð on ecne geard, utsiþes georn on sellan gesetu."
[036500 (1268)],    Nu ic swiðe eom weorce gewergad.
[036600 (1269)],"    Ða to þam wage gesag, heafelan onhylde, hyrde þa gena ellen on innan."
[036700 (1271)],"    Oroð stundum teah mægne modig, him of muðe cwom swecca swetast."
[036800 (1273)],"    Swylce on sumeres tid stincað on stowum staþelum fæste wynnum æfter wongum wyrta geblowene, hunigflowende, swa þæs halgan wæs ondlongne dæg oþ æfen forð oroð up hlæden."
[036900 (1278)],"    Þa se æþela glæm setlgong sohte, swearc norðrodor won under wolcnum, woruld miste oferteah, þystrum biþeahte, þrong niht ofer tiht londes frætwa."
[037000 (1282)],"    Ða cwom leohta mæst, halig of heofonum hædre scinan, beorhte ofer burgsalu."
[037100 (1284)],"    Bad se þe sceolde eadig on elne endedogor, awrecen wælstrælum."
[037200 (1286)],"    Wuldres scima, æþele ymb æþelne, ondlonge niht scan scirwered."
[037300 (1288)],"    Scadu sweþredon, tolysed under lyfte."
[037400 (1289)],"    Wæs se leohta glæm ymb þæt halge hus, heofonlic condel, from æfenglome oþþæt eastan cwom ofer deop gelad dægredwoma, wedertacen wearm."
[037500 (1293)],"    Aras se wuldormago, eadig elnes gemyndig, spræc to his onbehtþegne, torht to his treowum gesiþe: Tid is þæt þu fere, ond þa ærendu eal biþence, ofestum læde, swa ic þe ær bibead, lac to leofre."
[037600 (1298)],"    Nu of lice is, goddreama georn, gæst swiðe fus."
[037700 (1300)],"    Ahof þa his honda, husle gereorded, eaðmod þy æþelan gyfle, swylce he his eagan ontynde, halge heafdes gimmas, biseah þa to heofona rice, glædmod to geofona leanum, ond þa his gæst onsende weorcum wlitigne in wuldres dream."
[037800 (1305)],    Ða wæs Guðlaces gæst gelæded eadig on upweg.
[037900 (1306)],"    Englas <feredun> to þam longan gefean, lic colode, belifd under lyfte."
[038000 (1308)],"    Ða þær leoht ascan, beama beorhtast."
[038100 (1309)],"    Eal þæt beacen wæs ymb þæt halge hus, heofonlic leoma, from foldan up swylce fyren tor ryht aræred oð rodera hrof, gesewen under swegle, sunnan beorhtra, æþeltungla wlite."
[038200 (1314)],"    Engla þreatas sigeleoð sungon, sweg wæs on lyfte gehyred under heofonum, haligra dream."
[038300 (1317)],"    Swa se burgstede wæs blissum gefylled, swetum stencum ond sweglwundrum, eadges yrfestol, engla hleoðres, eal innanweard."
[038400 (1320)],"    Þær wæs ænlicra ond wynsumra þonne hit in worulde mæge stefn areccan, hu se stenc ond se sweg, heofonlic hleoþor ond se halga song, gehyred wæs, heahþrym godes, breahtem æfter breahtme."
[038500 (1325)],"    Beofode þæt ealond, foldwong onþrong."
[038600 (1326)],"    Ða afyrhted wearð ar, elnes biloren, gewat þa ofestlice beorn unhyðig, þæt he bat gestag, wæghengest wræc, <wæterþisa> for, snel under sorgum."
[038700 (1330)],"    Swegl hate scan, blac ofer burgsalo."
[038800 (1331)],"    Brimwudu scynde, leoht, lade fus."
[038900 (1332)],"    Lagumearg snyrede, gehlæsted to hyðe, þæt se hærnflota æfter sundplegan sondlond gespearn, grond wið greote."
[039000 (1335)],"    Gnornsorge wæg hate æt heortan, hyge geomurne, meðne modsefan, se þe his mondryhten, life <bilidenne>, last weardian wiste, wine leofne."
[039100 (1339)],    Him þæs wopes hring torne gemonade.
[039200 (1340)],"    Teagor yðum weol, hate hleordropan, ond on hreþre wæg micle modceare."
[039300 (1342)],    He þære mægeð sceolde lace gelædan laðspel to soð.
[039400 (1344)],"    Cwom þa freorigferð þær seo fæmne wæs, wuldres wynmæg."
[039500 (1345)],"    He þa wyrd ne mað, fæges forðsið"
[039600 (1346)],"    Fusleoð agol wineþearfende, ond þæt word acwæð: Ellen biþ selast þam þe oftost sceal dreogan dryhtenbealu, deope behycgan þroht þeodengedal, þonne seo þrag cymeð, wefen <wyrdstafum>."
[039700 (1351)],"    Þæt wat se þe sceal aswæman sarigferð, wat his sincgiefan holdne biheledne."
[039800 (1353)],    He sceal hean þonan geomor hweorfan.
[039900 (1354)],    Þam bið gomenes wana ðe þa earfeða oftost dreogeð on sargum sefan.
[040000 (1356)],"    Huru, ic swiðe ne þearf hinsiþ behlehhan."
[040100 (1357)],"    Is hlaford min, beorna bealdor, ond broþor þin, se selesta bi sæm tweonum þara þe we on Engle æfre gefrunen acennedne þurh cildes had gumena cynnes, to godes dome, werigra wraþu, worulddreamum of, winemæga wyn, in wuldres þrym, gewiten, <winiga> hleo, wica neosan eardes on upweg."
[040200 (1366)],"    Nu se eorðan dæl, banhus abrocen burgum in innan wunað wælræste, ond se wuldres dæl of licfæte in leoht godes sigorlean sohte, ond þe secgan het þæt git a mosten in þam ecan gefean mid þa sibgedryht somudeard niman, weorca wuldorlean, willum neotan blædes ond blissa."
[040300 (1374)],"    Eac þe abeodan het sigedryhten min, þa he <wæs> siþes fus, þæt þu his lichoman, leofast mægða, eorðan biðeahte."
[040400 (1377)],    Nu þu ædre const siðfæt minne.
[040500 (1378)],"    Ic sceal sarigferð, heanmod hweorfan, hyge <drusendne>."
