id,text
[000100 (1)],"    Ðus frod fæder freobearn lærde, modsnottor <mon>, maga cystum eald, wordum wisfæstum, þæt he wel þunge: Do a þætte duge, deag þin gewyrhtu; god þe biþ symle goda gehwylces frea ond fultum, feond þam oþrum wyrsan gewyrhta."
[000200 (7)],"    Wene þec þy betran, efn elne þis a þenden þu lifge."
[000300 (9)],"    Fæder ond modor freo þu mid heortan, maga gehwylcne, gif him sy meotud on lufan."
[000400 (11)],"    Wes þu þinum yldrum arfæst symle, fægerwyrde, ond þe in ferðe læt þine lareowas leofe in mode, þa þec geornast to gode trymmen."
[000500 (15)],    Fæder eft his sunu frod gegrette oþre siþe: Heald elne þis.
[000600 (17)],"    Ne freme firene, ne næfre freonde þinum, mæge man ne geþafa, þy læs þec meotud oncunne, þæt þu sy wommes gewita."
[000700 (19)],"    He þe mid wite gieldeð, swylce þam oþrum mid eadwelan."
[000800 (21)],"    Ðriddan syþe þoncsnottor guma breostgehygdum his bearn lærde: Ne gewuna wyrsa, widan feore, ængum eahta, ac þu þe anne genim to gesprecan symle spella ond lara rædhycgende."
[000900 (26)],    Sy ymb rice swa hit mæge.
[001000 (27)],"    Feorþan siðe fæder eft lærde modleofne magan, þæt he gemunde þis: Ne aswic sundorwine, ac a symle geheald ryhtum gerisnum."
[001100 (30)],"    Ræfn elne þis, þæt þu næfre fæcne <weorðe> freonde þinum."
[001200 (32)],"    Fiftan siþe fæder eft ongon breostgeþoncum his bearn læran: Druncen beorg þe ond dollic word, man on mode ond in muþe lyge, yrre ond æfeste ond idese lufan."
[001300 (37)],"    Forðon sceal æwiscmod oft siþian, se þe gewiteð in wifes lufan, fremdre meowlan."
[001400 (39)],"    Þær bið a firena wen, laðlicre scome, long nið wið god, geotende gielp."
[001500 (41)],"    Wes þu a giedda wis, wær wið willan, worda hyrde."
[001600 (43)],"    Siextan siþe swæs eft ongon þurh bliðne geþoht his bearn læran: Ongiet georne hwæt sy god oþþe yfel, ond toscead simle scearpe mode in sefan þinum ond þe a þæt selle geceos."
[001700 (48)],"    A þe bið gedæled; gif þe deah hyge, wunað wisdom in, ond þu wast geare ondgit yfles, heald þe elne wið, feorma þu symle in þinum ferðe god."
[001800 (52)],"    Seofeþan siþe his sunu lærde fæder, frod guma, sægde fela <geongum>: Seldan snottor guma sorgleas blissað, swylce dol seldon drymeð sorgful ymb his forðgesceaft, nefne he fæhþe wite."
[001900 (57)],"    Wærwyrde sceal wisfæst hæle breostum hycgan, nales breahtme hlud."
[002000 (59)],"    Eahtoþan siþe eald fæder ongon his mago monian mildum wordum: Leorna lare lærgedefe, wene þec in wisdom, weoruda scyppend hafa þe to hyhte, haligra gemynd, ond a soð to syge, þonne þu secge hwæt."
[002100 (65)],"    Nigeþan siþe nægde se gomola, eald uðwita sægde eaforan worn: nis nu fela folca þætte fyrngewritu healdan wille, ac him hyge brosnað, ellen colað, idlað þeodscype; ne habbað wiht for þæt, þeah hi wom don ofer meotudes bibod."
[002200 (71)],    Monig sceal ongieldan sawelsusles.
[002300 (72)],"    Ac læt þinne sefan healdan <forð> <fyrngewritu> ond frean domas, þa þe her on mægðe gehwære men forlætaþ swiþor asigan, þonne him sy sylfum ryht."
[002400 (76)],"    Teoþan siþe tornsorgna ful, eald eft ongon eaforan læran: Snyttra bruceþ þe fore sawle lufan warnað him wommas worda ond dæda on sefan symle ond soþ fremeð; bið him geofona gehwylc gode geyced, meahtum spedig, þonne he mon flyhð."
[002500 (83)],"    Yrre ne læt þe æfre gewealdan, heah in hreþre, heoroworda grund wylme bismitan, ac him warnað þæt on geheortum hyge."
[002600 (86)],"    Hæle sceal wisfæst ond gemetlice, modes snottor, gleaw in gehygdum, georn wisdomes, swa he wið ælda mæg eades hleotan."
[002700 (90)],"    Ne beo þu no to tælende, ne to tweospræce, ne þe on mode læt men to fracoþe, ac beo leofwende, leoht on gehygdum ber breostcofan."
[002800 (93)],"    Swa þu, min bearn, gemyne frode fæder lare ond þec a wið firenum geheald."
