id,text
[000100 (1)],"    Hwilum mec min frea fæste genearwað, sendeð þonne under <salwonges> bearm <þone> bradan, ond on bid wriceð, þrafað on þystrum þrymma sumne, <hæste> on enge, þær me heord siteð hruse on hrycge."
[000200 (6)],"    Nah ic hwyrftweges of þam <aglace>, ac ic eþelstol hæleþa <hrere>; hornsalu wagiað, wera wicstede, weallas beofiað, steape ofer stiwitum."
[000300 (10)],"    Stille þynceð lyft ofer londe ond lagu swige, oþþæt ic of enge up aþringe, efne swa mec wisaþ se mec wræde on æt frumsceafte furþum legde, bende ond clomme, þæt ic onbugan ne mot of þæs gewealde þe me wegas tæcneð."
[000400 (17)],"    Hwilum ic sceal ufan yþa wregan, <streamas> styrgan ond to staþe <þywan> flintgrægne flod."
[000500 (19)],"    Famig winneð wæg wið wealle, wonn ariseð dun ofer dype; hyre deorc on last, eare geblonden, oþer fereð, þæt hy gemittað mearclonde neah hea hlincas."
[000600 (24)],"    Þær bið hlud wudu, brimgiesta breahtm, bidað stille stealc stanhleoþu streamgewinnes, hopgehnastes, þonne heah geþring on cleofu crydeþ."
[000700 (28)],"    Þær bið ceole wen sliþre sæcce, gif hine sæ byreð on þa grimman tid, gæsta fulne, þæt he scyle rice birofen weorþan, feore bifohten fæmig ridan yþa hrycgum."
[000800 (33)],"    Þær bið egsa sum ældum geywed, þara þe ic hyran sceal strong on stiðweg."
[000900 (35)],    Hwa gestilleð þæt?
[001000 (36)],"    Hwilum ic þurhræse, þæt me on bæce rideð won wægfatu, wide toþringe lagustreama full, hwilum læte eft slupan tosomne."
[001100 (39)],"    Se bið swega mæst, breahtma ofer burgum, ond gebreca hludast, þonne scearp cymeð sceo wiþ oþrum, ecg wið ecge; earpan gesceafte fus ofer folcum fyre swætað, blacan lige, ond gebrecu ferað deorc ofer <dryhtum> gedyne micle, farað feohtende, feallan lætað sweart sumsendu seaw of bosme, wætan of wombe."
[001200 (48)],"    Winnende fareð atol eoredþreat, egsa astigeð, micel modþrea monna cynne, brogan on burgum, þonne blace scotiað scriþende scin scearpum wæpnum."
[001300 (53)],"    Dol him ne ondrædeð ða deaðsperu, swylteð hwæþre, gif him soð meotud on geryhtu þurh regn ufan of gestune læteð stræle fleogan, farende flan."
[001400 (57)],"    Fea þæt gedygað, þara þe geræceð rynegiestes wæpen."
[001500 (59)],"    Ic þæs orleges or anstelle, þonne gewite wolcengehnaste þurh geþræc þringan þrimme micle ofer byrnan bosm."
[001600 (62)],"    Biersteð hlude heah hloðgecrod; þonne hnige eft under lyfte helm londe near, ond me <on> hrycg hlade þæt ic habban sceal, meahtum <gemagnad> mines frean."
[001700 (67)],"    Swa ic þrymful þeow þragum winne, hwilum under eorþan, hwilum yþa sceal <hean> underhnigan, hwilum holm ufan streamas styrge, hwilum stige up, wolcnfare wrege, wide fere swift ond swiþfeorm."
[001800 (72)],"    Saga hwæt ic hatte, oþþe hwa mec rære, þonne ic restan ne mot, oþþe hwa mec stæðþe, þonne ic stille beom."
