id,text
[000100 (1)],"    Is þes middangeard missenlicum wisum gewlitegad, wrættum gefrætwad."
[000200 (3)],"    Siþum sellic ic seah searo hweorfan, grindan wið greote, giellende faran."
[000300 (5)],"    Næfde sellicu wiht syne ne folme, exle ne earmas; sceal on anum fet searoceap swifan, swiþe feran, faran ofer feldas."
[000400 (8)],    Hæfde <fela> ribba; muð wæs on middan.
[000500 (9)],"    Moncynne nyt, <fereð> foddurwelan, folcscipe dreogeð, wist in wigeð, ond werum gieldeð gaful geara gehwam þæs þe guman brucað, rice ond heane."
[000600 (13)],"    Rece, gif þu cunne, wis worda gleaw, hwæt sio wiht sie."
