id,text
[000100 (1)],"    Frod wæs min <fromcynn> <biden> in burgum, siþþan bæles weard <wera> life bewunden, fyre <gefælsad>."
[000200 (4)],"    Nu me fah warað eorþan broþor, se me ærest wearð gumena to gyrne."
[000300 (6)],"    Ic ful gearwe gemon hwa min fromcynn fruman agette eall of earde; ic him yfle ne mot, ac ic <hæftnyd> hwilum arære wide geond wongas."
[000400 (10)],"    Hæbbe ic <wundra> fela, middangeardes mægen unlytel, ac ic miþan sceal monna gehwylcum degolfulne dom dyran cræftes, siðfæt minne."
[000500 (14)],    Saga hwæt ic hatte.
