id,text
[000100 (1)],"    Her Eadward kingc, Engla hlaford, sende soþfæste sawle to Criste on godes wæra, gast haligne."
[000200 (4)],"    He on worulda her wunode þrage on kyneþrymme, cræftig ræda, XXIIII, freolic wealdend, wintra gerimes, weolan britnode, and healfe tid, hæleða wealdend, weold wel geþungen Walum and Scottum and Bryttum eac, byre Æðelredes, Englum and Sexum, oretmægcum, swa ymbclyppað cealde brymmas, þæt eall Eadwarde, æðelum kinge, hyrdon holdlice hagestealde menn."
[000300 (15)],"    Wæs a bliðemod bealuleas kyng, þeah he lange ær, lande bereafod, wunode wræclastum wide geond eorðan, syððan Cnut ofercom kynn Æðelredes and Dena weoldon deore rice Engla landes XXVIII wintra gerimes, welan brytnodon."
[000400 (22)],"    Syððan forð becom freolice in geatwum kyningc kystum god, clæne and milde, Eadward se æðela, eðel bewerode, land and leode, oðþæt lungre becom deað se bitera, and swa deore genam æþelne of eorðan; englas feredon soþfæste sawle innan swegles leoht."
[000500 (29)],"    And se froda swa þeah befæste þæt rice heahþungenum menn, Harolde sylfum, æþelum eorle, se in ealle tid hyrde holdlice hærran sinum wordum and dædum, wihte ne agælde þæs þe þearf wæs þæs þeodkyninges."
