id,text
[000100 (1)],"    Wæs on ealddagum Israheala folc þurh Moysen, mærne lareow, anlyht and gelared, swa hine lifes frea, heofna heahcyning, her on life þurh his sylfes word sette for leodum, rincum to ræde, and him runa gescead sylfum asæde, hu he þone soþan weg leofum leodscipe læran <sceolde>."
[000200 (9)],"    Þa se leoda fruma larum fyligde heofena heahcyninges, and þa hæleþ samod, swa hie on leodscipe lærede wæron; gyf hie wancule <weorc> ongunnon, heom þæs of heofonum hearm to leane asende sigora god, and hie sona to him fryþa wilnodan and þær fundon raþe, gif hie leohtras heora letan gewyrpan."
[000300 (17)],"    Feala is mægena þe sio mære þeod on þam herescype heold and worhte, þendan hie lifes frean lufian woldon; ac him se ende wearð earm and <þrealic>, þa hie besyredon sylfne dryhten, on beam setton and to byrgenne gedemdon; he þær bedigled wæs, and þy þryddan dæge þeodum ætywed."
[000400 (25)],"    We þæt gehyrdon hæleþa mænige on bocstafum breman and writan, þæt hie fæstenu feower heoldon and þonne offredan unmæne neat, þæt is lamb oþþe styrc, leofum to tacne þe for <worulde> wæs womma bedæled."
[000500 (31)],"    Ac arisan ongan rices ealdor of byrgenne, blæda gefylled, and mid heofenwarum ham gesohte, eard mid englum, and us eallum þone hyht and gehateð, gyf we his willaþ þurh rihtne sefan rædum fyligan."
[000600 (37)],"    Na þær in cumeð atele gefylled, <womme> gewesed, ac scal on wyrd sceacan."
[000700 (39)],"    Nu we herian sceolan her for life deorne dædfruman, and him geara gerim ælmesdædum ure gefyllan, and on fæstenum, swa se froda iu Moyses mælde, and we þa mearce sceolan heoldan higefæste mid Anglum, swa hie gebrefde us beorn on Rome, Gregorius, gumena papa."
[000800 (47)],"    <We> þæt forme sceolan fæsten heowan on þære ærestan <wucan> lengtenes, on þam monþe þe man Martius geond Romwara rice <nemneð>, and þær twelfe sceolan torhtum dihte runa gerædan in þæs rican hofe, heofona heahcyninges, herian mid sange, wlancne weorþian wuldres bryttan."
[000900 (55)],"    Ofer þa Eastertid oþer fæsten ys to bremenne Brytena leodum mid gelicum lofe, þe gelesen hafað on <þære> wucan þe æfter <cumeð> þam sunnandæge þe geond sidne wang Pentecostenes dæg preostas nemnað, on þam monþe, þæs þe me þinceð, þe man Iunius gearum nemde."
[001000 (63)],"    Ðonne is þæt þrydde þinga gehwelces fæsten on foldan fyra bearnum dihte gelicum on þam deoran hofe to brymenne beorhtum sange on þære wucan þe ærur byð emnihtes dæge ælda beornum, on þam monþe, mine gefræge, þe man September genemneð."
[001100 (71)],"    We þæt feorþe sceolen <fæsten> gelæstan on <þære> wucan þe bið ærur full dryhtnes gebyrde, and we mid deornum scylan wordum and weorcum wuldres cyninge in þa ylcan tid eallum gemynde þeodne deman þinga gehwylces, efne swa swa ærran, and þone arwesan leofne leoda frean lifes biddan."
[001200 (79)],"    On þissum fæstenum is se feorþa dæg and sixta samod <seofoþa> getinge to gelæstanne lifes ealdre and to bremenne boca gerynum emb þa nigoþan tyd; nan is on eorþan, butan hine unhæl an geþreatige, þe mot, hæt, oþþe wæt ærur þingan, þæs þe us boca dom þeodlic demeð."
[001300 (87)],"    Gif þe þonne secgan suþan cymene <bryttan> Franca, þæt þu gebann sceole her on eorþan ænig healdan, þæs þe Moyses <iu> mælde to leodum, na þu þæs andfeng æfre gewyrþe, ac þu þæt <sylfe> heald þæt þe suþan com from Romana <rices> hyrde, Gregoriæ, gumena papa."
[001400 (95)],"    Þus he gesette sylf ond dyhte þa þenunga, þeodlareow, fæstendtida; we þam forþ nu gyt geond Engla land estum <filiað>."
[001500 (99)],"    Swa he æt þæm setle sylfa gedemde, sancte Petres preostas syþþan lange lifes tyd leordun þæt sylfe, þæt þu oþrum ne scealt æfre filian."
[001600 (103)],"    Eac we feowertig daga fæsten healden ær þæm æriste ures dryhtnes, þæt nu lengtentid leoda nemnað, and hit ærest ongan eorl se goda, mære Moyses, ær he on munt styge; he þæt fæsten heold feowertig daga and nyhta samod, swa he nahtes <anbat> ær he þa deoran æ dryhtnes anfenge."
[001700 (111)],"    Him þær gesealde sylfe dryhten bremne boca cræft, bæle behlæned, of his haligan handa gescrifene, het hine leodum þone leoran and tæcan elda orþancum eallum to tacne, þæt we mid fæstene magon freode gewinnan and þa deopan dryhtnes gerynu, þa þe <leoran> sceolan leoda gehwylce, gif us þære duguþe hwæt dryhten sylleð."
[001800 (120)],"    Eft Helias, eorl se mæra, him on westene wiste geþigede, þær him symbelbread somod mid wætere dryhtnes engla sum dihte togeanes, and se gestrangud wearð styþum gyfle to gefæstenne feowertig daga and nihta samod, swa he nahtes anbat ær he on Horeb dun hali ferde."
[001900 (128)],"    Uton þæt gerine rihte gehicgan, þæt se mæra <þegen> mihta ne hæfde to astigenne stæppon on ypplen ær him þæt symbel wearþ seald fram engle."
[002000 (132)],"    We sint on westene wuldres blisse on þæm ænete ealra gefeana; nu is helpes tid, halig dryhten, hu we munt þinne mærne gestygan."
[002100 (136)],    Sint for englas geteald <eorþbugendum> þa þe dryhtnes word dædum lærað.
[002200 (138)],"    We þa andlifene ofstum þycgen and þone deoran wist, dryhtnes lare; uton <fæstan> swa fyrene dædum on forhæfenesse her for life, þæt we þæs muntes mægen mærþa gestigan swa se ealda <dyde> Elias iu."
[002300 (144)],"    Is to hicganne hu se halga gewat of þissum wangstede wuldres neosian; hine fyren scryd feower mærum wlangum wicgum on weg ferede on neorxnawong, þær us nergend Crist gehaten hafað ham mid blisse, gif we þæt fæsten her fyrena gelæstað and þone uplican æþel secað."
[002400 (152)],"    Nu wæs æt nehstan þæt us nergend Crist, halig heofenes weord, heolp and lærde."
[002500 (154)],"    He hine dyppan let deorum þweale, fulwihtes <bæðe>, fyrena bedæled, and he feowertig daga <firsude> <mettas>, eac nihta swa feala nanuht gyltig, leodum to lare, þæt hie on lengten sceolan efen feowertig daga fæsten hewan."
[002600 (160)],"    Hine costude þær Cristes gewinna on þæm ænete eald and fræte, geseah mærne frean mannum gelicne and þa wenan ongann, wommes gemyndig, þæt he stræla his stellan mihte on þam lichoman."
[002700 (165)],"    Næs þæs leahtra nan, ac on hinder gewat hearmes brytta, and þær englas hyra ealdor sohtan."
[002800 (168)],"    Higesynnig man, gyf þe susla weard costian durre, þonne he Crist dyde, wereda wulderfrean, womma leasne, ne mæg he þæs inne ahwæt scotian gif he <myrcels> næfþ manes æt egum, ac he on hinder scriþ, and þe halig englas ærfæste æghwær helpað, gif þu dryhtnes her dædum fylgest."
[002900 (176)],"    Hæbbe we nu gemearcod hu þa mæran iu feowertig daga fæsten hewdon, and we bebeodað þurh beorn godes þæt manna gehwilc þe for moldan wunað ær þam æreste ures dryhtnes efen feowertig daga fæsten hewe oþ þa nigoþan tid, and he na bruce flæsces oþþe fyrna, þæ læs þe he fah <wese>."
[003000 (184)],"    Sceolan sacerdas singan mæssan, dæghwamlice dryhten biddan on þam fæstenne þæt he freond wese folce gynd foldan, and þa fyrna sceolan þam sacerdan secgan gehwilce and þa <dymnissa> dædum betan wordes and weorces, wuldres ealdor þurh ælmesdæde eall gegladian."
[003100 (192)],"    Þonne is þearf micel þeoda mænium þæt þa sacerdos <sylfe> ne gyltan, ne on leahtrum hiora ligegen to fæste."
[003200 (195)],"    Hwa mæg þyngian þreale hwilcum wiþ his arwesan, gyf he him ærur hæfð bitere onbolgen, and þæs bote ne deð, ac þa æbyligþe ealdere wrohte, <dæghwamlice> dædum niwað?"
[003300 (200)],"    Gyf se sacerd hine <sylfne> ne cunne þurh dryhtnes ege dugeþum healdan, nu þa, folces mann, fyrna <ne> gyme þe <gehalgod> mann her gefremme, ac þu lare scealt lustum <fremman> ryhthicgennde þe he to <ræde> tæchð, drince he him þæt drofe oððe þæt dæghluttre wæter of wege, þæt is wuldres lare."
[003400 (208)],"    Ac ic secgan mæg, sorgum hremig, hu þa sacerdas sace niwiað, dæghwamlice dryhten gremiað and mid <æfeste> ælcne forlædað þe him fylian wyle folces manna."
[003500 (213)],"    Sona hie on mergan mæssan syngað and forþegide, þurste gebæded, æfter tæppere teoþ geond stræta."
[003600 (216)],    Hwæt.
[003700 (216)],"    Hi leaslice leogan ongynnað and þone tæppere tyhtaþ gelome, secgaþ þæt he synleas syllan mote ostran to æte and æþele wyn emb morgentyd, <þæs> þe me <þingeð> þæt hund and wulf healdað þa ilcan wisan on worulde and ne wigliað <hwæne> hie to mose fon, mæða bedæled."
[003800 (224)],"    Hi þonne sittende sadian aginnað, <sinne> semað, syllað gelome, <cweðað> goddlife gumena gehwilcum þæt wines dreng welhwa mote, siþþan he mæssan hafað, meþig þicgan, etan ostran eac and oþerne fisc of flode"
