id,text
[000100 (1)],"    Wenne, wenne, wenchichenne, her ne scealt þu timbrien, ne nenne tun habben, ac þu scealt north eonene to þan nihgan berhge, þer þu hauest, ermig, enne broþer."
[000200 (5)],    He þe sceal legge leaf et heafde.
[000300 (6)],"    Under fot <wolues>, under ueþer earnes, under earnes clea, a þu geweornie."
[000400 (8)],"    Clinge þu alswa col on heorþe, scring þu alswa <scerne> awage, and weorne alswa weter on anbre."
[000500 (11)],"    Swa litel þu gewurþe alswa linsetcorn, and miccli lesse alswa anes handwurmes hupeban, and alswa litel þu gewurþe þet þu nawiht gewurþe."
