id,text
[018500 (178)],"    Ac hit is yfel soð, swa hit þincan mæg, þæt sume synd to wlance and ealles to rance and to widscriþole and to unnytte and ealles to idele ælcere goddæde and to mandæde on dyrnlican galscype, inne aidlode and ute awildode."
[018600 (179)],"    And sume syn apostatan þe sceoldan, gyf hi woldan, wesan Godes cempan innan heora mynstran."
[018700 (180)],    Þæt synd þa <earman> þe hadas awurpan and on woruldþingan wuniað mid synnan.
[018800 (181)],"    Eall hit færeð yfele ealles to wide; swa swyðe hit wyrsað wide mid mannum, þæt þæs hades men, þe þurh Godes ege hwylum wæron nyttoste and geswincfulleste on godcundan þeowdome and on boccræfte, þa syndon nu wel forð unnyttaste gewelhwær and ne swincaþ a swiðe ymbe ænige þearfe for Gode ne for worulde."
[018900 (182)],"    Ac maciað eall be luste and be eþnesse and lufiað oferwiste and idele blisse, woriað and wandriað and ealne dæg fleardiað, spelliað and spiliað and nænige note dreogað."
[019000 (183)],"    Þæt is laðlic lif, þæt hi swa maciað, eac hit is þe wyrse, þe ealdras hit ne betað, ne sylfe swa wel farað sumes, swa hi sceoldan."
[019100 (184)],"    Ac we agan neode þæt we hit gebetan, swa we geornost magan, and weorðan anmode to gemænelicre þearfe for Gode and for worulde."
[019200 (185)],    Be mynecenan.
[019300 (185)],"    Riht is þæt mynecena mynsterlice macian, efne swa we cwædon æror be munecan, and ne towettan woruldmannum ne ænige sundorcyððe to heom habban ealles to swyðe, ac a regolice libban and hi symle asyndrian fram woruldbysegan, swa hi geornost magan."
[019400 (186)],    Be preostan and be nunnan.
[019500 (186)],"    Riht is, ðæt preostas and efen wel nunnan regollice libban and clænnysse healdan be þam, þe hi willan on mynstran gewunian oððon for worulde weorðscypes wealdan."
[019600 (187)],    Be læwedum mannum.
[019700 (187)],"    Riht is, ðæt gehadode men læwede wissian, hu hi heora æwe rihtlicost sculon healdan."
[019800 (188)],"    Þæt bið rihtlic lif, þæt cniht þurhwunige on his cnihthade, oðþæt he on rihtre mædenæwe gewifige, and hæbbe þa syððan and nænige oðre, þa hwile þe seo libbe."
[019900 (189)],"    Gif hire þonne forðsið gebyrige, þonne is rihtost, þæt he þananforð <wydewa> þurhwunige."
[020000 (190)],    Ðeah be ðæs apostoles leafe læwede man mot for neode oðre siðe wifian.
[020100 (191)],"    Ac þa canones forbeodaþ þa bletsunge þærto, þe to frumwifunge gesette syn."
[020200 (192)],    And eac is geset dædbot swylcum mannum to donne.
[020300 (193)],"    And preoste is forboden, þæt <he> beon ne mot, on ðam wisan, þe he ær wæs, æt þam brydlacum, þær man eft wifað, ne þa bletsunge don, þe to frumwifunge gebyrað."
[020400 (194)],"    Be þam man mæg witan, þæt hit eallunga riht nis, þæt wer wifige oðþon wif ceorlige oftor þonne æne."
[020500 (195)],"    And huru hit byð to mænigfeald, gewyrðe hit þriddan siðe, and mid ealle misdon, gewyrðe hit oftor."
[020600 (196)],"    And þeah læwedum mannum wif sy alyfed, þeah hi agon þearfe, þæt hi understandan, hu hit is alyfed."
[020700 (197)],"    Nagon læwede men freolstidum ne fæstentidum þurh hæmedðing wifes gemanan, þe ma þe heahhades men þæt ðing agan ænigum timan."
[020800 (198)],    Be wudewan.
[020900 (198)],"    Riht is, ðæt wydewan Annan bysenan geornlice fylian."
[021000 (199)],    Seo wæs on temple dæges and nihtes þeowiende georne.
[021100 (200)],    Heo fæste swyðe þearle and gebedum fyligde and geomeriendum mode clypode to Criste and ælmessan dælde oft and gelome.
[021200 (201)],    And aa Gode gecwemde þæs ðe heo mihte wordes and dæde and hæfð nu to edleane heofonlice myrhðe.
[021300 (202)],    Swa sceall god wydewe hyran hyre drihtne.
[021400 (203)],    Be cyrican.
[021500 (203)],"    Riht is, ðæt cristene men cristendom georne healdan mid rihte and Cristes cyrican æghwær geornlice weorþian and werian."
[021600 (204)],"    Ealle we habbað ænne heofonlicne fæder and ane gastlice modor, seo is ecclesia genamod, þæt is Godes cyrce, and <þa> we sculon æfre lufian and weorðian."
[021700 (205)],"    And riht is, þæt ælc cyrice sy on Godes griðe and on ealles cristenes folces, and þæt cyricgrið stande æghwær binnan wagum and gehalgodes cynincges handgrið efen unwemme."
[021800 (206)],"    Forðam ælc cyricgrið is Cristes agen grið, and ælc cristen man ah mycle þearfe, þæt he on þam griðe mycle mæþe wite."
[021900 (207)],"    Forðam ælces cristenes mannes nydþearf is, þæt he Godes cyrican georne lufige and weorðige and hi gelomlice <and> geornlice sece him sylfum to ðearfe."
[022000 (208)],    And huru gehadode þær sculon oftost ðeowian and ðenian and for eall cristen folc ðingian georne.
[022100 (209)],"    Þonne agan weofodðenas to smeagenne symble, þæt hi huruðinga heora lif fadian, swa swa to cyrcan gebyrige mid rihte."
[022200 (210)],"    Cyrice is mid rihte sacerdes æwe, and se ðe to cyrican weorðe gehadod, nage hine ænig man, ðe Godes lage recce, þanon to donne, butan he <hi> mid heafodgylte fullice forwyrce."
[022300 (211)],"    And ðonne sceall Cristes scirgerefa þæt witan and ymbe þæt dihtan and deman, swa swa bec tæcan."
[022400 (212)],    And ne sceolde man æfre cyrican derian ne ænig woh beodan on ænige wisan.
[022500 (213)],    Ac nu syndon þeah cyrcan wide and side wace gegriðode and yfele geðeowode and clæne berypte ealdra gerihta and innan bestrypte ælcera gerisena.
[022600 (214)],    And cyricþenas syndon <mæðe> and munde gewelhwær bedælde.
[022700 (215)],"    And wa þam, þe ðæs wealt, þeh he swa ne wene."
[022800 (216)],"    Forðam ælc ðara byð witodlice Godes sylfes feond, þe byð Godes cyricena feond and ðe Godes cyricena riht wanað oðþon wyrdeþ, ealswa hit awriten is."
[022900 (217)],"Inimicus enim Christi efficitur omnis, qui ecclesiasticas res usurpare iniuste conatur, et reliqua."
[023000 (218)],"    And egeslice spræc sanctus Gregorius be ðam eac, þa ða he þus cwæð."
[023100 (219)],"Si quis ecclesiam Christi denudauerit uel sanctimonia uiolauerit, anathema sit. Ad quod respondentes omnes dixerunt, amen. Mycel is neodþearf manna gehwilcon, þæt he wið þas ðinc beorge him georne, and æghwylc Godes freond warnige hine symble þæt he Cristes bryde to swyðe ne misbeode."
[023200 (221)],    Ealle we sculon ænne God lufian and weorðian and ænne cristendom georne healdan and ælcne hæþendom mid ealre mihte awyrpan.
[023300 (222)],"    And utan ænne cynehlaford holdlice healdan, and freonda gehwylc oðerne healde mid rihtan getrywðan."
[023400 (223)],    Be eallum cristenum mannum.
[023500 (223)],"    Riht is, ðæt ealle cristene men heora cristendom rihtlice healdan and ðam life libban, þe heom to gebyrað æfter Godes rihte and æfter woruldgerysenum."
[023600 (224)],"    And heora wisan ealle be þam ðingan geornlice fadian, þe ða wisian, ðe hy wislice and wærlice wisian cunnon."
[023700 (225)],"    And þæt is þonne ærest ræda fyrmest, þæt manna gehwylc ofer ealle oðre þinc ænne God lufige and ænne geleafan anrædlice hæbbe on ðæne, þe us ealle ærest geworhte and mid deorwyrðum ceape eft us gebohte."
[023800 (226)],"    And eac we agan þearfe, þæt we geornlice smeagan, hu we symble magan Godes agene beboda rihtlicost healdan and eall þæt gelæstan, þæt þæt we behetan, þa we fulluht underfengon oðþon þa þe æt fulluhte ure forespræcon wæron."
[023900 (227)],"    Ðæt is ðonne ærest, þæt þæt man behateþ, þonne man fulluhtes gyrnð, þæt man a wile deofol ascunian and his unlare georne forbugan and ealle his unlaga symble awyrpan and ecelice wiðsacan <ealles> his gemanan."
[024000 (228)],"    And manisiðes sona þærafter mid rihtan geleafan soðlice swytelað, þæt man þananforð aa wile on ænne God æfre gelyfan and ofer ealle oðre þing hine a lufian and æfre his larum geornlice fylgean and his agene beboda rihtlice healdan."
[024100 (229)],"    And þonne bið þæt fulluht, swylce hit wedd sy ealra þæra worda and ealles ðæs behates, gehealde, se ðe wille."
[024200 (230)],"    And soð is, þæt is secge, englas beweardiað þananforð æfre manna gehwylcne, hu he gelæste æfter his fulluhte, þæt man behet ær, þa man fulluhtes gyrnde."
[024300 (231)],"    Utan þæt geðencan oft and gelome and georne gelæstan, þæt þæt we behetan, þa we fulluht underfengan ealswa us þearf is."
[024400 (232)],    And utan word and weorc rihtlice fadian and ure ingeðanc clænsian georne and að and wedd werlice healdan.
[024500 (233)],"    And gelome understandan þone mycclan dom, þe we ealle to scylon."
[024600 (234)],"    And beorgan us georne wið þone weallendan bryne hellewites, and geearnian us ða mærða and ða myrhða, ðe God hæfð gegearwod þam ðe his willan on worulde gewyrcað, Amen."
