id,text
[017500 (72.1)],"    And gif se bonda, ær he dead wære, beclypod, þonne andwyrdan þa yrfenuman, swa he sylf sceolde, þeah he lif hæfde."
[017600 (73)],"    & sitte ælc wuduwe werleas xii monað, ceose syððan þæt heo sylf wylle."
[017700 (73a)],"    & gif heo binnan geares fæce wer geceose, þonne þolige heo þære morgengyfe & ealra þæra æhta, þe heo þurh ærran wer hæfde; & fon þa nehstan frynd to ðam landan & to þan æhtan, þe heo ær hæfde."
[017800 (73.1)],"    & si he his weres scyldig wið þone cingc oððe wið þone, þe he his socne geunnen hæbbe."
[017900 (73.2)],"    & þeah heo nydnumen weorðe, þolige þæra æhta, butan heo from þam ceorle wylle eft ham ongean & næfre heo eft his ne weorðe."
[018000 (73.3)],    & na hadige man æfre wudewan to hrædlice.
[018100 (73.4)],"    And gelæste ælc wuduwe þa heregeatu binnan xii monðum, butan hyre ær to onhagige, witeleas."
[018200 (74)],"    & na nyde man naðer ne wif ne mæden to þam, þe hyre sylfre mislicie, ne wið sceatte ne sylle, butan he hwæt agenes ðances gyfan wylle."
[018300 (75)],"    And ic læte riht, <þeah> hwa his spere sette to oðres mannes huses dura, & he þiderinn ærende hæbbe, oððon gif mon oðer wæpne gedreohlice lecgce, þær hig stille mihtan beon, gif hi moston."
[018400 (75)],"    & hwylc man ðonne þæt wæpn gelæcce & hwylcne hearm þærmid gewyrce, þonne is þæt riht, þæt se ðe þone hearm geworhte, þæt se þone hearm gebete."
[018500 (75.1)],"    & se ðe þæt wæpn age, hine geladige, gif he durre, þæt hit næfre næs naðer ne his gewill ne his geweald ne his ræd ne his gewitnes; þonne is þæt Godes riht, þæt he beo clæne."
[018600 (75.2)],"    & wite se oðer, þe þæt weorc geworhte, þæt he hit bete, swa swa <lagan> tæcean."
[018700 (76)],"    And gyf hwylc man forstolen þingc ham to his cotan bringe & he arasod wurðe, riht is, þæt he hæbbe þæt he æftereode."
[018800 (76.1)],"    & butan hit under þæs wifes cæglocan gebroht wære, si heo clæne."
[018900 (76.1a)],"    ac þære cægean heo sceal weardian, þæt is hyre hordern & hyre cyste & hyre tege: gif hit under þyssa ænigum gebroht byð, þonne byð heo scyldig."
[019000 (76.1b)],"    & ne mæg nan wif hyre bondan forbeodan, þæt he ne mote into his coton gelogian þæt þæt he wylle."
[019100 (76.2)],"    Hit wæs ær þyson, þæt þæt cild, þe læg on cradele, þeah hit næfre metes ne abite, þæt þa gitseras letan efenscyldig & hit gewittig wære."
[019200 (76.3)],"    Ac ic hit forbeode heonon forð eornostlice & swylce manege, þe gode syndon swyðe laþe."
[019300 (77)],"    & se man, þe ætfleo fram his hlaforde oððe fram his geferan for his yrhþe, si hit on scipfyrde, si hit on landfyrde, þolige ealles þæs þe he age & his agenes feores; & fo se hlaford to þam æhtan & to his lande, þe he him ær sealde."
[019400 (77.1)],"    & gyf he bocland hæbbe, ga þæt þam cingce to handa."
[019500 (78)],"    And se man, þe on þam fyrdunge ætforan his hlaforde fealle, si hit innan lande, si hit of lande, beon ða heregeata forgyfene; & fon þa erfenuman to lande & to æhtan & scyftan hit swyðe rihte."
[019600 (79)],"    And se ðe land gewerod hæbbe on scire gewitnesse & se nolde oððe ne mihte, þe hit ær ahte, hæbbe unbesacen on dæge & æfter dæge to syllenne & to gyfenne þam þe him leofost si."
[019700 (80)],"    And ic wylle, þæt ælc man si his huntnoðes wyrðe on wuda & on felda on his agenan."
[019800 (80.1)],"    & forga ælc man minne huntnoð, locehwær ic hit gefriðod wylle habban, be fullan wite."
[019900 (81)],    And drincelean & hlafordes rihtgifu stande æfre unawend.
[020000 (82)],"    & ic wylle, þæt ælc man si griðes wyrðe to gemote & fram gemote, butan he si æbære þeof."
[020100 (83)],"    & se ðe þas laga wyrde, ðe se cingc hæfð nu ða eallon mannon forgyfen, si he Denisc oððe Englisc, beo he his weres scyldig wið þone cingc."
[020200 (83.1)],"    & gif he hit eft wyrde, gylde tuwa his were."
[020300 (83.2)],"    & gyf he þonne swa dyrstig sig, þæt he hit þriddan syðe wyrde, þolige ealles þæs þe he age."
[020400 (84)],"    Nu bidde ic georne & on godes naman beode manna gehwylcne, þæt he inweardre heortan gebuge to his drihtne & oft & gelome smeage swyðe georne, hwæt him sig to donne & hwæt to forganne."
[020500 (84.1)],"    Eallum us is mycel þearf, þæt we god lufian & godes lage fylgean & godcundan lareowan geornlice hyran."
[020600 (84.1a)],"    forðam hi sceolon us lædan forð æt þam dome, þonne god demð manna gehwylcum be ærran gewyrhtan."
[020700 (84.2)],"    And gesælig byð se hyrde, þe þonne ða heorde into godes rice & to heofonlicre myrhþe bliðe mot lædan for ærran gewyrhtan."
[020800 (84.2a)],"    and wel þære heorde, ðe gefolgað þam hyrde, þe hig deoflum ætweneð & gode hig gestryneð."
[020900 (84.3)],"    Utan þonne ealle anmodre heortan georne urum Drihtne cweman mid rihte & heonon forð symle scyldan us georne wið þone hatan bryne, þe wealleð on helle."
[021000 (84.4)],"    And don nu eac lareowas & godcunde bydelas, swa swa hit riht is & ealra manna þearf is; bodian gelome godcunde þearfe."
[021100 (84.4a)],"    & ælc þe gescead wite, hlyste him georne, & godcunde lare gehwa on geþance healde swyðe fæste, him sylfum to þearfe."
[021200 (84.4b)],    & a manna gehwylc to weorðunge his drihtne do to gode þæt he mæge wordes & dæde glædlice æfre; þonne byð us eallum godes milts þe gearwur.
[021300 (84.5)],"    A sy godes nama ecelice gebletsod, & lof him & wuldor & wyrðmynt symle æfre to worulde."
[021400 (84.6)],"    God ælmihtig us eallum gemiltsige, swa his milda willa sig & gehealde us æfre on ecnesse; si hit swa, amen."
