id,text
[000100 (1)],    Þis synt þa landgemære to withmere.
[000200 (2)],"    Ærst of trente þær þa ðeofes hangað on middan bere fordes holme, of ðan holme to geriht to þan lewe butan fif lan beheonan of þan landan to þan sice."
[000300 (4)],"    Of þan syce to þan mære þorne usweardan forstun of þan þorne to an æcer, of an æcere in þone hæge, of ðan hæge, in þæm broce."
[000400 (6)],"    And long broces,<../images/tbar.gif>cume on þone dic, on ansyðelege, norð æfter dice<../images/tbar.gif>cume on ceolfes crofte, on þone þe ioerneð fram eansyðelege."
[000500 (8)],"    Æfter stræte to þan stubbe, of þan stubbe, on þone dic, æfter dice<../images/tbar.gif>on stræte<../images/tbar.gif>yrnð bi ebrocan, of ðan stræte on þone dic."
[000600 (9)],"    Of þan dice, on geriht on þone sich þe yrnð be chese wælle hylle, & hunger hylle, æfter syche on geriht on þe ellen þe stundað on wihtmere mære ant stretones."
[000700 (12)],"    Of þan ellan, on þone forð æfte syce þe scoet of þan forde on trentan up æfter trente<../images/tbar.gif>cume þære þe þeofes hengað,<../images/lbar.gif>ant pylltunes landes æcer ant mæd land, healf into wihtmere & healf in to roluestune."
