id,text
[000100 (1)],    Gif feoh sy undernumen.
[000200 (2)],"    Gif hit sy hors, singon his feotere oððe on his bridels."
[000300 (3)],"    Gif hit sy oðer feoh, sing on þæt hofrec, and ontend ðreo candela and dryp on þæt hofrec wæx ðriwa."
[000400 (4)],    Ne mæg hit ðe manna forhelan.
[000500 (6)],"    Gif hit sy inorf, sing on feower healfa þæs huses and æne on middan."
[000600 (8)],"Crux Christi reducat. Crux Christi per furtum periit, inventa est. (10) Abraham tibi semitas, vias, montes concludat, Job et flumina. Ad iudicium ligatum perducat."
[000700 (13)],"    Judeas xri Crist ahengon, ðæt him com to wite swa strangum."
[000800 (15)],"    Gedydon heom dæda þa wyrstan, hi þæt drofe forguldon."
[000900 (16)],"    Hælon hit him to hearme miclum, and heo hit na forhelan ne mihton."
