id,text
[000100 (1.1)],Beatvs vir qui non abiit in consilio impiorvm et in uia peccatorum non stetit et in cathedra pestilentie non sedit& on wege synfulr na stod & on <heahsetle> cwyldes<../images/lbar.gif>wawan na sæt.
[000200 (1.2)],sed in lege domini uoluntas eius; et in lege eius meditabitur die ac nocteac on æ drihten willa his & on æ his smeað<../images/lbar.gif>foreþænð dæges & nihtes.
[000300 (1.3)],"Et erit tanquam lignum quod plantatum est secus decursus aquarum; quod fructum suum dabit in tempore suo, et folium eius non defluet; et omnia quecunque faciet prosperabuntur& biþ swa swa treow þæt plantud is wið ryne wætera þæt wæstm his selð on tide his & leaf his na & ealle swa hwilc swa he deþ beoþ gesundfullude."
[000400 (1.4)],Non sic impii non sic; sed tanquam puluis quem proicit uentus a facie terrena swa arlease na swa ac swa swa dust þæt wyrpþ wind of ansyne eorðan.
[000500 (1.5)],Ideo non resurgunt impii in iudicio; neque peccatores in consilio iustorumforþan na arisaþ arlease on dome & ne synfulle.
[000600 (2.1)],Quare fremuerunt gentes; et populi meditati sunt inaniahwi grimetedon þeoda & folc smeadon unnite<../images/lbar.gif>idele.
[000700 (2.2)],Astiterunt reges terre et principes conuenerunt in unum; aduersus dominum et aduersus christum eiusætstodon cyningas eorþan & ealdormen becomon tosomne ongean drihten & ongean crist his.
[000800 (2.3)],Dirumpamus uincula eorum; et proiciamus a nobis iugum ipsorumwe tosliton bændas heora & utun awyrpan fram us geoc heora.
[000900 (2.4)],Qui habitat in celis irridebit eos; et dominus subsannabit eosse þe eardað on heofonum hiscð hi & drihten hyspeþ hi.
[001000 (2.5)],tunc loquetur ad eos in ira sua; et in furore suo conturbabit eosþonne he spycþ to him on his yrre & on hatheortnesse gedrefð hi.
[001100 (2.6)],Ego autem constitutus sum rex ab eo super sion montem sanctum eius; predicans preceptum eiusic soþlice geseted eom cyncg fram him ofer sion munt haligne his bodiende bebod his.
[001200 (2.7)],"dominus dixit ad me, filius meus es tu, ego hodie genui tedrihten cwæþ sunu min eart þu ic todæg cænde þe."
[001300 (2.8)],"Postula a me, et dabo tibi gentes hereditatem tuam; et possessionem tuam terminos terregyrn fram me & ic sille þe þeoda yrfeweardnisse þine & æhta þine gemæro eorðan."
[001400 (2.9)],Reges eos in uirga ferrea; et tanquam uas figuli confringes eosþu geræcest hi on girde isernre swa swa fæt tigelwyrhtan þu tobrecest hi.
[001500 (2.10)],Et nunc reges intelligite; erudimini qui iudicatis terram& nu cynincgas ongytað beoð gelærede ge demað eorþan.
[001600 (2.11)],Seruite domino in timore; et exultate ei cum tremoreþeowiað drihten on ege & geblissiað hi on fyrhto.
[001700 (2.12)],Apprehendite disciplinam; nequando irascatur dominus; et pereatis de uia iustagegripað lare þylæs hwonne yrsige drihten & ge forweorðen of þam rihtan wege.
[001800 (2.13)],cum exarserit in breui ira eius; beati omnes qui confidunt in eoþonne byrneþ annunga yrre his eadig ealle þa þe on hine getriwað.
[001900 (3.2)],Domine quid multiplicati sunt qui tribulant me? multi insurgunt aduersum meid est pater tohwi gemænigfylde sind þa ðe swæncað me mænige onarisað ongean me.
[002000 (3.3)],Multi dicunt anime mee; non est salus ipsi in deo eiuscweþað<../images/lbar.gif>secað sawle minre hælo on gode his<../images/lbar.gif>hyre.
[002100 (3.4)],Tu autem domine susceptor meus es; gloria mea et exaltans caput meumonfoend wuldor min & uphebbende heafod.
[002200 (3.5)],voce mea ad dominum clamaui; et exaudiuit me de monte sancto suostæfne minre ic cleopode & he gehyrde me of his þam halgan munte.
[002300 (3.6)],Ego dormiui et soporatus sum; et exurrexi quia dominus suscepit meic slep onfeng me.
[002400 (3.7)],Non timebo milia populi circundantis me; exurge domine saluum me fac deus meusic ne ondræde þusendu folces ymbsellende<../images/lbar.gif>ymbtrymmende ariseid estpater halne me doid estpater mi.
[002500 (3.8)],Quoniam tu percussisti omnes aduersantes mihi sine causa; dentes peccatorum contriuistiforþon þu ofsloge ealle wiþergende me intingan teþ synfulfra þu forbryttest.
[002600 (3.9)],Domini est salus; et super populum tuum benedictio tuadrihten is is hælo & ofer folc þin bletsuncg þin.
[002700 (4.6)],"Sacrificate sacrificium iustitie et sperate in domino; multi dicunt, quis ostendit nobis bonaonseccað onsægðnesse rihtwisnesse & gehihte ge monige cweþað hwylc þeowð us god."
[002800 (4.7)],Signatum est super nos lumen uultus tui domine; dedisti letitiam in corde meogetacnod is ofer leoht andwlitan þines þu sealdest blisse on heortan minre.
[002900 (4.8)],"A fructu frumenti, uini, et olei sui; multiplicati sunthwætes wines & eles his hi sind gemænigfyld."
[003000 (4.9)],In pace in idipsum; dormiam et requiescamon sibbe on þæt sylfe ic slape & reste.
[003100 (4.10)],Quoniam tu domine; singulariter in spe constituisti mesynderlice on hihte þu gesetest me.
[003200 (5.2)],verba mea auribus percipe domine; intellige clamorem meumword mine earum onfoh ongyt clypunge mine.
[003300 (5.3)],Intende uoci orationis mee; rex meus et deus meusbegym stæfne gebedes mines cyning min & god min.
[003400 (5.4)],Quoniam ad te orabo domine; mane exaudies uocem meamforþon to þe ic gebidde on mergen & þe gehyrst stæfne minre.
[003500 (5.5)],"Mane astabo tibi, et uidebo; quoniam non deus uolens iniquitatem tu eson mergen ic ætstande þe & ic geseo þætte na willende unrihtwise."
[003600 (5.6)],Neque habitabit iuxta te malignus; neque permanebunt iniusti ante oculos tuos& na eardað wið þe awyrged & na þurhwuniað unrihtwise ongean eagan þine.
[003700 (5.7)],"Odisti omnes qui operantur iniquitatem; perdes omnes qui loquntur mendacium, virum sanguinum et dolosum abominabitur dominusatedest<../images/lbar.gif>þu feodest ealle þe wyrcað unrihtwisnesse þu forspillest þe sprecað leasunge wer bloda & facenfulne onscunað."
[003800 (5.8)],"ego autem in multitudine misericordie tuae, introibo in domum tuam; adorabo ad templum sanctum tuum in timore tuoic soþlice on mengeo mildheortnesse þinre ic inga on hus þin ic gebidde to temple halgum þinum on ege þinum."
[003900 (5.9)],Domine deduc me in iustitia tua propter inimicos meos; dirige in conspectu tuo uiam meamdrihten gelæd ne on rihtwisnesse þinre fore feondum minum gerece on gesihþe þinre weg minne.
[004000 (5.10)],Quoniam non est in ore eorum ueritas; cor eorum uanum estforþon nis on muþe heora soþfæstnys heorte heora idel is.
[004100 (5.11)],"Sepulchrum patens est guttur eorum, linguis suis dolose agebant; iudicia illos deus, decidant a cogitationibus suis; secundum multitudinem impietatum eorum expelle eos, quoniam irritauerunt te dominebyrigen onpengende is hrace heora tungum heora facenfulle dydon dem hi god hi areosen fram geþohtum heora æfter mænego arleasnesse heora adræf hi."
[004200 (5.12)],"Et letentur omnes qui sperant in te; in eternum extulabunt, et habitabis in eis, et gloriabuntur in te omnes qui diligunt nomen tuum& geblissigen hihtað on ecnesse hi ahebbað & þu oneardast on him & hi wuldrian on þe ealle lufiað naman þinne."
[004300 (5.13)],"quoniam tu benedices iusto, domine ut scuto bone uoluntatis tue coronasti nosswa of scylde godes willan þines þu gehelmedest us."
[004400 (6.2)],domine ne in furore tuo arguas me; neque in ira tua corripias meon yrre þinum þu þrea<../images/lbar.gif>cide me.
[004500 (6.3)],Miserere mei domine quoniam infirmus sum; sana me domine quoniam conturbata sunt ossa meauntrum ic eom hæle me gedrefede syndon ban mine.
[004600 (6.4)],Et anima mea turbata est ualde; et tu domine usquequo& saul min gedrefed is swiþe & þu drihten hu lange.
[004700 (6.5)],Conuertere domine et eripe animam meam; saluum me fac propter misericordiam tuambeo gecyrred drihten & nere sawle mine halne me gedo fore mildheortnesse þinre.
[004800 (6.6)],Quoniam non est in morte qui memor sit tui; in inferno autem quis confitebitur tibion deaðe gemyndig si þin on helle soðlice hwylc geandetteð þe.
[004900 (6.7)],"Laboraui in gemitu meo; lauabo per singulas noctes lectum meum, lacrimis meis stratum meum rigabois swang on geomrunga minre ic swylige þurh syndriga nihta bedd min of tearum stræle mine ic lecce<../images/lbar.gif>wæte."
[005000 (6.8)],Turbatus est a furore oculus meus; inueteraui inter omnes inimicos meosgedrefed is eahge min ic ealdode betweox ealle fynd mine.
[005100 (6.9)],Discedite a me omnes qui operamini iniquitatem; quoniam exaudiuit dominus uocem fletus meigewitað fram me ealle þe wyrcaþ unrihtwisnessa forðan gehyrde drihten stæfne wopes mines.
[005200 (6.10)],Exaudiuit dominus deprecationem meam; dominus orationem meam suscepitgehyrde drihten bene minre gebedd.
[005300 (6.11)],Erubescant et conturbentur uehementer omnes inimici mei; conuertantur et erubescant ualde uelociterablysigen<../images/lbar.gif>scamien & syn drefed ealle fynd mine syn gecyrred & aswarnigen swiþe hrædlice<../images/lbar.gif>onunga.
[005400 (7.2)],Domine deus meus in te speraui; saluum me fac ex omnibus persequentibus me et libera meon þe ic gehihte ehtendum.
[005500 (7.3)],Nequando rapiat ut leo animam meam; dum non est qui redimat neque qui saluum faciatðilæs hwonne gegripe<../images/lbar.gif>reafige swa swa leo saule mine þonne nis alyse & na þe halne do.
[005600 (7.4)],Domine deus meus si feci istud; si est iniquitas in manibus meisgyf ic dyde þis gif is unrihtwisnes on handum minum.
[005700 (7.5)],si reddidi retribuentibus mihi mala; decidam merito ab inimicis meis inanisgyf ic ageald gildendum me yfelu ic areose be gewyrhtum fram feondum minum idel.
[005800 (7.6)],Persequatur inimicus animam meam et comprehendat et conculcet in terra uitam meam; et gloriam meam in puluerem deducatehte feond saule mine & gripe & fortredeð on eorðan lif min & wuldor min on dust gelæde he.
[005900 (7.7)],Exurge domine in ira tua; exaltare in finibus inimicorum meorum. exurge domine deus meus in precepto quod mandastiaris on eorre þinum upahefe on endum feonda on bebode þe þu bebude.
[006000 (7.8)],"et sinagoga populorum circundabit te, et propter hanc in altum regredere& gesomnunge folca ymbsylleð þe & fore þas on heahnesse gehwyrfþ."
[006100 (7.9)],dominus iudicat populos. iudica me domine secundum iustitiam meam; et secundum innocentiam meam super medrihten dem folcc dem me æfter rihtwisnesse unscyldignesse.
[006200 (7.10)],Consummetur nequitia peccatorum; et dirige iustum scrutans corda et renes deus. iustumsi geændad nið synfulra & gerece riht scrudniende heortan & æddran riht.
[006300 (7.11)],adiutorium meum a domino; qui saluos facit rectos cordefultum se hale deþ rihtwise on heorte.
[006400 (7.12)],"Deus iudex iustus, fortis et patiens; nunquid irascitur per singulos diesdema rihtwis strang & cwyst þu eorseð þurh sindrige dagas."
[006500 (7.13)],Nisi conuersi fueritis gladium suum uibrabit; arcum suum tetendit et parauit illumnimþe sweord his ascæcð bogan his he aþenede & gyrede hine.
[006600 (7.14)],Et in eo parauit uasa mortis; sagittas suas ardentibus effecitfatu deaðes flana his byrnendum gefremede.
[006700 (7.15)],Ecce parturit iniustitiam; concepit dolorem et peperit iniquitatemongesyhþe he geeacnað unrihtwisnesse he onfeng sar & he cende unrihtwisnesse.
[006800 (7.16)],Lacum aperuit et effodit eum; et incidit in foueam quam fecitseaþ openude & adealf hine & hreas on seað þone he worhte.
[006900 (7.17)],Conuertetur dolor eius; in caput eius et in uerticem ipsius iniquitas eius descendetbyþ gecyrred sar his on heafde his & on hnol unrihtwisnes astah.
[007000 (7.18)],Confitebor domino secundun iustitiam eius; et psallam nomini domini altissimiic andette drihtene rihtwisnesse his & ic singe naman þæs hihstan.
[007100 (8.2)],Domine dominus noster; quam admirabile est nomen tuum in uniuersa terra. quoniam eleuata est magnificentia tua; super caelosure hu wundurlic is nama þin on ealre eorðan upahauen is gemiclung<../images/lbar.gif>mærð þin heofenas.
[007200 (8.3)],"Ex ore infantium et lactentium perfecisti laudem; propter inimicos tuos, ut destruas inimicum et ultoremof muþe cildra & succendra þu fulfremedest lof fore feondum þinum þæt þu toweorpe feond."
[007300 (8.4)],Quoniam uidebo celos tuos opera digitorum tuorum; lunam et stellas quas tu fundastiforþon ic geseo heofonas weorc fingra þinra monam & steorran hwylce þu gestaþolodest.
[007400 (8.5)],Quid est homo quod memor es eius; aut filius hominis quoniam uisitas eumhwæt is man þæt gemindig eart his oððe sunu mannes þæt þu neosast hine.
[007500 (8.6)],Minuisti eum paulo minus ab angelis; gloria et honore coronasti eumþu wanodest hine lytle læs fram englum of wuldre & arweorðunga þu gehelmudest hine.
[007600 (8.7)],et constituisti eum super opera manuum tuarum& gesetst hine ofer weorc handa þinra.
[007700 (8.8)],"Omnia subiecisti sub pedibus eius; oues et boues uniuersas, insuper et pecora campieal þing þu underþeoddest under fotum his sceap & oxan ealle & ufon on & þæt neat feldes."
[007800 (8.9)],volucres celi; et pisces maris qui perambulant semitas marisfugelas heofonas & fixas sæs ða þurhgaþ stiga sæs.
[007900 (8.10)],Domine dominus noster; quam admirabile est nomen tuum in uniuersa terradrihten drihten ure hu wundorlic is nama þin on ealrae eorþan.
[008000 (9.2)],Confitebor tibi domine in toto corde meo; narrabo omnia mirabilia tuaic andette þe drihten on ealre heortan minre ic secge<../images/lbar.gif>rece ealle wuldor þine.
[008100 (9.3)],Letabor et exultabo in te; psallam nomini tuo altissimeic blissige & ic wunsumige on þe & singe naman þinne þam hihstan.
[008200 (9.4)],In conuertendo inimicum meum retrorsum; infirmabuntur et peribunt a facie tuain togecyrrenne feondum minum on bæc beoð geuntrumod & forweorðað on ðynre ansyne.
[008300 (9.5)],Quoniam fecisti iudicium meum et causam meam; sedes super thronum qui iudicas iustitiamforðon þu gedydest dom minne & intingan mine þu siest ofer þrymstel þu þe demest rihtwisnesse.
[008400 (9.6)],Increpasti gentes et periit impius nomen eorum delesti in eternum et in seculum seculiþu þreadest þeoda & forweorðað þa arleasan nama heora þu adilegadest on ecnesse & on worlda world.
[008500 (9.7)],Inimici defecerunt framee in finem; et ciuitates eorum destruxisti. periit memoria eorum cum sonitufynd geteorodon cocor on ænde & ceaster þu towurpe forweorðeð gemynd heora mid swege.
[008600 (9.8)],et dominus in eternum permanet. parauit in iudicio thronum suum& drihten on ecnesse þurhwunað gegearwod on dome stel his.
[008700 (9.9)],"et ipse iudicabit orbem terre in equitate, iudicabit populos in iustitia& sylf demð ymbhwyrft eorðan on emnesse he demð folcum mid<../images/lbar.gif>on rihtwysnesse."
[008800 (9.10)],Et factus est dominus refugium pauperi; adiutor in opportunitatibus; in tribulatione& geworden is drihten gebeorh þearfan gefultumend on gehiðlicnesse<../images/lbar.gif>þæslicnesse on geswince.
[008900 (9.11)],Et sperent in te qui nouerunt nomen tuum; quoniam non dereliquisti querentes te domine& hihten on þe cuþon þu na forlæst secende þe drihten.
[009000 (9.12)],Psallite domino qui habitat in sion; annuntiate inter gentes studia eiussingaþ drihtne þe eardaþ on besceawodnisse bodiað betweox þeoda.
[009100 (9.13)],Quoniam requirens sanguinem eorum recordatus est; non est oblitus clamorem pauperumsecende blod heora he na ofergeat þearfena.
[009200 (9.14)],Miserere mei domine; uide humilitatem meam de inimicis meismildsa me geseoh eaðmodnesse mine feondum minum.
[009300 (9.15)],Qui exaltas me de portis mortis; ut annuntiem omnes laudationes tuas in portis filie sionþu þe ahefst me of gum deofleos þæt ic bodige ealle lofu þina on gatum dohturid est ecclesiastice fidei.
[009400 (9.16)],Exultabo in salutari tuo; infixe sunt gentes in interitu quem fecerunt. in laqueo isto quem absconderunt; comprehensus est pes eorumic blissige on hælo þinre gefestnode synd þeoda on forwyrde þe hi worhton on grine þyssum þe hi digledon gegripen is fot heora.
[009500 (9.17)],Cognoscetur dominus iudicia faciens; in operibus manuum suarum comprehensus est peccatorbyð oncnawen domas fremmende on weorcum handa his gegripen is se synfulla.
[009600 (9.18)],Conuertantur peccatores in infernum; omnes gentes que obliuiscuntur deumsin gecyrred þa synfullan on helle ealle þeoda þe ofergytað.
[009700 (9.19)],Quoniam non in finem obliuio erit pauperis; patientia pauperum non peribit in finemon ende ofergitulnis þearfena geþyld þearfana na forweorðeð on ende.
[009800 (9.20)],Exurge domine non confortetur homo; iudicentur gentes in conspectu tuoaris drihten man syn demed þeoda on gesihðe þinre.
[009900 (9.21)],Constitue domine legislatorem super eos; sciant gentes quoniam homines suntgesete æs lædend ofer hy witen þeoda þæt men synd.
[010000 (9.22)],"Vt quid domine recessisti longe. despicis, in opportunitatibus in tribulationetohwy gewite ðu feor þu forsyhstid eston gerecum on geswince."
[010100 (9.23)],Dum superbit impius incenditur pauper; comprehenduntur in consiliis quibus cogitantþonne ofermodgaþ þe arleasa bið anæled þearfa beoð gegripene on geþohtum hi þohtan.
[010200 (9.24)],Quoniam laudatur peccator in desideriis anime sue et iniquus benediciturbið hered se synfulla on gewilnungum saule his he bið gebletsod.
[010300 (9.25)],Exacerbauit dominum peccator; secundum multitudinem ire sue non queretse synfulla æfter mænigfealdnisse his yrre ne secð.
[010400 (9.26)],Non est deus in conspectu eius; inquinate sunt uie illius in omni tempore. auferuntur iudicia tua a facie eius; omnium inimicorum suorum dominabiturnis on gesihþe wegas on ælcere tide beoð afyrred domas þine on ansyne ealra feonda his bewylt.
[010500 (9.27)],Dixit enim in corde suo; non mouebor a generatione in generationem sine malohe cwæð soþlice in heortan ic ne beo astyred of cneorisse on cneorisse butan yfele.
[010600 (9.28)],Cuius maledictione os plenum est et amaritudine et dolo; sub lingua eius labor et dolorþæs of wirignesse muð full is & biternesse & of facne under his geswinc & sar.
[010700 (9.29)],Sedet in insidiis cum diuitibus; in occultis ut interficiat innocentemhe siteð on searwum mid welum on digelnissum þæt he ofslea unscyldigne.
[010800 (9.30)],Oculi eius in pauperem respiciunt; insidiatur in abscondito quasi leo in spelunca sua; insidiatur ut rapiat pauperem rapere pauperem; dum attrahit eumegan his on þearfan beseoð he syrwð he syrwð þæt gripe þearfan gegripan þearfan þonne he hine fram tyþ hine.
[010900 (9.31)],"In laqueo suo humiliabit eum; inclinabit se et cadet, cum dominatus fuerit pauperumon his grine his geniþrað hine he onhildeþ & gehreowseþ þonne."
[011000 (9.32)],"Dixit enim in corde suo; oblitus est deus, auertit faciem suam ne uideat in finemhe cwæð soðlice on heortan his oferget he acyrde ansyne þilæs he geseo oð ende."
[011100 (9.33)],Exurge domine deus exaltetur manus tua; ne obliuiscaris pauperumsy upahefen hand ne ofergyt ðu þearfana.
[011200 (9.34)],"Propter quid irritauit impius deum. dixit enim in corde suo, non requiretfore hwæt bysmrade se arleasa cwyð soþlice on heortan his secð<../images/lbar.gif>myngað."
[011300 (9.35)],Uides quoniam tu laborem et dolorem consideras; ut tradas eos in manus tuas. tibi derelictus est pauper; orphano tu eris adiutorþu gesihst þæt þu geswinc & sar besceawast þæt þu sylle hy on handum þinum þe læfed is þearfa þu byst gefylsta.
[011400 (9.36)],Contere brachium peccatoris et maligni; queretur peccatum illius et non inuenieturþu forbrytest earm synfulles & awyrgydes bið soht & na he meted biþ.
[011500 (9.37)],Dominus regnabit in eternum et in seculum seculi; peribitis gentes de terra illiusrixað on ecnesse forweorðað ge þeoda of eorðan.
[011600 (9.38)],Desiderium pauperum exaudiuit dominus; preparati onem cordis eorum audiuit auris tuagyrninge þearfana gehyrde heortan heora gehyrde eare þin.
[011700 (9.39)],Ivdicare pupillo et humili; ut non apponat ultra magnificare se homo super terramdeman steopcilde & eaðmodum þætte na getiohige<../images/lbar.gif>togesette ofer þæt gumiclian hineid estanticrist ofer eorþan.
[011800 (10.2)],In domino confido; quomodo dicitis anime mee transmigra in montem sicut passeron drihtne ic getrywe humeta secgað ge saule minre aleor on munt swa swa spearwa.
[011900 (10.3)],"Quoniam ecce peccatores intenderunt arcum, parauerunt sagittas suas in pharetra; ut sagittent in obscuro rectos cordeforðon ongesyhðe sinfulle aþenedon bogan hy gyredon flana heora on cocore þæt hi scotigen on þystrum rihtwise on heortan."
[012000 (10.4)],Quoniam que perfecisti destruxerunt; iustus autem quid fecitþa þu dydest hy tobræcon se rihtwisa hwæt he dyde.
[012100 (10.5)],Dominus in templo sancto suo; dominus in celo sedes eius. oculi eius in pauperem respiciunt; palpebre eius interrogant filios hominumon temple halgum his setl his egan on þearfan beseoð bræwas acsiað bearn manna.
[012200 (10.6)],Dominus interrogat iustum et impium; qui autem diligit iniquitatem odit animam suamacsað rihtwisne & arleasne þe soþlice lufaþ unrihtwisnesse he hatat saule his.
[012300 (10.7)],"Pluit super peccatores laqueos; ignis, sulphur, et spiritus precellarum, pars calicis eorumhe rinð ofer synfulle grin fyres sweflþrosm & gast ysta dæl cælcis heora."
[012400 (10.8)],Quoniam iustus dominus et iustitias dilexit; equitatem uidit uultus eiusrihtwis & rihtwisnesse he lufude efennesse gesyhð andwlita his.
[012500 (11.2)],"Saluum me fac domine, quoniam defecit sanctus; quonian diminute sunt ueritates a filiis hominumhalne teorode halig forðon gewanede synd soðfæstnessa fram bearnum manna."
[012600 (11.3)],vana loquti sunt unusquisque ad proximum suum; labia dolosa in corde et corde loquti suntidelu hi spræcon anra gehwilc to nyhstan welere facenfullum on heortan & of heortan hy spræcon.
[012700 (11.4)],Disperdat dominus uniuersa labia dolosa; et linguam magniloquamforspille ealle weleras fæcne tungan þa felaspeculan.
[012800 (11.5)],"Qui dixerunt, linguam nostram magnificabimus labia nostra a nobis sunt; quis noster dominus estþa cwædon tungan ure we gemicliað weleras ure of us synd hwylc ure drihten."
[012900 (11.6)],"Propter miseriam inopum et gemitum pauperum; nunc exurgam, dicit dominus. ponam in salutari; fiducialiter agam in eofore yrmþe unspedigra & geomrumge þearfana nu ic arise cwæð drihten ic asette on hælo<../images/lbar.gif>on halwendnesse getreowfullice ic dem on þæm."
[013000 (11.7)],"Eloquia domini eloquia casta; argentum igne examinatum probatum terre, purgatum septuplumspræca spræca syfra seolfor of fyre amered eorþan aclænsod seofanfealdlice."
[013100 (11.8)],Tu domine seruabis nos; et custodies nos a generatione hac in eternumþu gehealdst us & beweardast us fram cneorisse þysre on ecnisse.
[013200 (11.9)],In circumitu impii ambulant; secundum altitudinem tuam multiplicasti filios hominumon trundelnesse arleasæ gangað æfter heahnesse þinre þu gemænigfyldest bearn manna.
[013300 (12.1)],vsquequo domine obliuisceris me in finem. usquequo auertis faciem tuam a mehu lange drihten ofergyst þu me on ænde oð hwæt acyrrest þu ansyne þine fram me.
[013400 (12.2)],Quamdiu ponam consilia in anima mea; dolorem in corde meo per diemhu lange sette ic geþeaht on saule minre sar on heortan min þurh dæg.
[013500 (12.3)],vsquequo exaltabitur inimicus meus super mebið upahafen feond.
[013600 (12.4)],respice et exaudi me domine deus meus. illumina oculos meos ne unquam obdormiam in mortembeseoh & gehyr me onliht eagan mine þylæs æfre ic slape on deaðe.
[013700 (12.5)],"nequando dicat inimicus meus, preualui aduersus eum. qui tribulant me exultabunt si motus fueroþulæs hwonne cweþeid est diabolusic magude ongean hine þa þe swencað me gif ic gedrefed."
[013800 (12.6)],"ego autem in misericordia tua speraui. Exultabit cor meum in salutari tuo; cantabo domino qui bona tribuit mihi, et psallam nomini domini altissimiic soðlice mildheortnesse þine hyhte blissað heorte min hælo þinre ic singe drihtene þe god sealde me ic singe naman drihtnes þæs hystan."
[013900 (13.1)],"Dixit insipiens in corde suo; non est deus. corrupti sunt et abominabiles facti sunt in studiis suis; non est qui faciat bonum, non est usque ad unumcwæð unwis on heortan his na is god gewænde syndon & onscunigendlic gewordene syndon on heora lustum ne is se þe do god ne is oð ende."
[014000 (13.2)],Dominus de celo prospexit super filios hominum ut uideat si est intelligens aut requirens deumdrihten on heofonum forð locode ofer bearn manna þæt he gesyhð hwæt sy ongitende oððe secende god.
[014100 (13.3)],"Omnes declinauerunt, simul inutiles facti sunt; non est qui faciat bonum, non est usque ad unum. sepulchrum patens est guttur eorum, linguis suis dolose agebant; uenenum aspidum sub labiis eorum. quorum os maledictione et amaritudine plenum est; ueloces pedes eorum ad effundendum sanguinem. contritio et infelicitas in uiis eorum, et uiam pacis non cognouerunt; non est timor dei ante oculos eorumealle ahyldon samod on unnytte gewordene syndon ne is se þe do god ne is oð ende byrgen opnigen is raca heora tungan heora facenfullice doð attor næddrena tungan under heora þara muð wirigcwedolnesse & biternesse full is hraðe fet heora to ageotenne blod forðræstnes & ungesælignes on wegum heora & weg sybbe hig ne ongeaton ne is ege godes beforan eagan heora."
[014200 (13.4)],Nonne cognoscent omnes qui operantur iniquitatem; qui deuorant plebem meam sicut escam panisac hig ne oncneowon ealle þa þe weorcað unriht ge þe fræton folc min swa swa mete hlafes.
[014300 (13.5)],Dominum non inuocauerunt; illic trepidauerunt timore ubi non erat timordrihten ne gecigdon þær forhtodon mid ege þar se ne wæs ege.
