id,text
[043600 (32.13)],De celo respexit dominus; uidit omnes filios hominumof heofone gelocode geseah ealle sunu manna.
[043700 (32.14)],De preparato habitaculo suo; respexit super omnes qui habitant terramof gearwudre eardunge his he gelocode ofer ealle þe eardigað.
[043800 (32.15)],Qui finxit singilatim corda eorum; <qui> intelligit omnia opera eorumse hiwode todæledlice heortan heora se angyt ealle weorc heora.
[043900 (32.16)],Non saluatur rex per multam uirtutem; et gigas non saluabitur in multitudine uirtutis suena bið gehæled þurh micel mægen & gigant na byð gehæled on mængo.
[044000 (32.17)],Fallax equus ad salutem; in abundantia autem uirtutis sue non saluabiturhors to hælo ungenihtsumnisse mægenes his.
[044100 (32.18)],Ecce oculi domini super metuentes eum; et in eis qui sperant super misericordia eiusingesihðe eagan ondrædende hine ofer.
[044200 (32.19)],vt eruat a morte animas eorum; et alat eos in famefram deaðe sawlas heora & fede hy on hungre.
[044300 (32.20)],Anima nostra sustinet dominum; quoniam adiutor et protector noster estsaul ure forbyrdigað drihten gefylsta & gescyldend ure he is.
[044400 (32.21)],Quia in eo letabitur cor nostrum; et in nomine sancto eius sperabimusblissað heorte ure & on naman halgum his we hyhtaþ.
[044500 (32.22)],Fiat misericordia tua domine super nos; quemadmodum sperauimus in tesy mildheortnis þin ofer us gehyhton on þe.
[044600 (33.2)],Benedicam dominum in omni tempore; semper laus eius in ore meoic bletsige drihten on ælcre tide symle lof his on muðe minun.
[044700 (33.3)],In domino laudabitur anima mea; audiant mansueti et letenturon drihtne byð hered saul min gehyren þa bylwitan & blissien.
[044800 (33.4)],Magnificate dominum mecum; et exaltemus nomen eius in idipsumgemicliað mid me & we upahebben naman his.
[044900 (33.5)],Exquisiui dominum et exaudiuit me; et ex omnibus tribulationibus meis eripuit meic sohte & he gehyrde me & of eallum geswincum minum he nerede.
[045000 (33.6)],Accedite ad eum et illuminamini; et facies uestre non confundenturgenealæcað to him & ge beoð onlyhte eowre ne beoð gescende.
[045100 (33.7)],"Iste pauper clamauit, et dominus exaudiuit eum; et ex omnibus tribulationibus eius saluauit eumþes þearfa cleopode gehyrde hine & lof eallum geswincum his hine."
[045200 (33.8)],Inmittet angelus domini in circumitu timentium eum; et eripiet eosasendeþ engel on ymbhwyrftte ondrædendra hine & he genereþ hy.
[045300 (33.9)],Gustate et uidete quoniam suauis est dominus; beatus uir qui sperat in eoonbyrgað & geseoð wynsum eadig wer þe gehyht.
[045400 (33.10)],Timete dominum omnes sancti eius; quoniam non est inopia timentibus eumondrædað halige his þam adrædendum.
[045500 (33.11)],Diuites eguerunt et esurierunt; inquirentes autem dominum non minuentur omni bonobeþorfton & hy hingredon þa secenda soþlice drihten eallum gode.
[045600 (33.12)],Venite filii audite me; timorem domini docebo uoscumað bearn gehyrað me ege drihtenes ic lære eow.
[045700 (33.13)],Quis est homo qui uult uitam; diligit dies uidere bonoshwilc is mann þe wile lif dagas geseon gode.
[045800 (33.14)],Prohibe linguam tuam a malo; et labia tua ne loquantur dolumtungan þine fram yuele & weleras þine ne specan facen.
[045900 (33.15)],Diuerte a malo et fac bonum; inquire pacem et persequere eamfram yfele & do god sec sibbe & fylg þa.
[046000 (33.16)],Oculi domini super iustos; et aures eius ad preces eorumeagan ofer rihtwise & earan his on benum heora.
[046100 (33.17)],Vultus autem domini super facientes mala; ut perdat de terra memoriam eorumandwilita donde yuelu þæt he forspille of eorðan gemynd heora.
[046200 (33.18)],Clamauerunt iusti et dominus exaudiuit eos; et ex omnibus tribulationibus eorum liberauit eosclypedon rihtwise gehyrde hy & of eallum geswincum heora he alysde hy.
[046300 (33.19)],Iuxta est dominus his qui tribulato sunt corde; et humiles spiritu saluabitneah þæm þe geswencendne synd heortan & eaðmode gaste he gehæleð.
[046400 (33.20)],Multe tribulationes iustorum; et de omnibus his liberabit eos dominusmænige geswinc rihtwis & of eallum þam alyseð.
[046500 (33.21)],Custodit dominus omnia ossa eorum; unum ex his non contereturgehealdeð ealle ban heora an of þam ne bið tobrocen.
[046600 (33.22)],Mors peccatorum pessima; et qui oderunt iustum delinquentdeað synfulra wyrst & þa þe hatedon rihtwisne hy agyteð.
[046700 (33.23)],Redimet dominus animas seruorum suorum; et non delinquent omnes qui sperant in eoalyseþ<../images/lbar.gif>nereð drihten saula þeowra hys & na forlæteð he ealle þa þe hyhtað on þe.
[046800 (34.1)],Iudica domine nocentes me; expugna impugnantes medem deriende me oferwin onwinnende me.
[046900 (34.2)],Apprehende arma et scutum; et exurge in adiutorium mihigegrip wæpn & scyld & aris on fultum me.
[047000 (34.3)],"Effunde frameam et conclude aduersus eos qui persequuntur me; dic anime mee, salus tua ego sumageot ut flane & beluc ongean hy þe me ehtaþ me sege sawle hælo þin ic eom."
[047100 (34.4)],confundantur et reuereantur; querentes animam meam. auertantur retrorsum et confundantur; cogitantes mihi malagesceamien & wandien sawle mine syn gecyrrede underbæcling & gesceamien yuelu.
[047200 (34.5)],Fiant tanquam puluis ante faciem uenti; et angelus domini coartans eoshy syn swa swa dust beforan ansiene windes & engel hy.
[047300 (34.6)],Fiat uia illorum tenebre et lubricum; et angelus domini persequens eossie weg þystro & slidornis & engel ehtende hy.
[047400 (34.7)],Quoniam gratis absconderunt mihi interitum laquei sui; superuacue exprobrauerunt animam meamgifum hy behyddon on forwyrd grines his hy hyspton sawle mine.
[047500 (34.8)],"Veniat illi laqueus quem ignorat; et captio quam abscondit apprehendat eum, et in laqueum cadat in ipsumcume him grin þæt hy ne gecnæwað & gegripennis gegripe hyne & on grine fealle on þæt selue."
[047600 (34.9)],Anima autem mea exultabit in domino; et delectabitur super salutari suosawl min blissode on drihtene & bið gelustfullod ofer hælo his.
[047700 (34.10)],"Omnia ossa mea dicent; domine, quis similis tui? eripiens inopem de manu fortiorum eius; egenum et pauperem a diripientibus eumealle ban cweðað hwilc gelic neriende unspedigne of handa strengran his ælþeodigne & þearfan<../images/lbar.gif>fram reafigendum hine."
[047800 (34.11)],Surgentes testes iniqui; que ignorabam interrogabant mearisende cyðras unrihtwise þa ic nyste hi ahsedon me.
[047900 (34.12)],Retribuebant mihi mala pro bonis; sterilitatem anime meeaguldon me yuelu fore gode stedignesse sawle minre.
[048000 (34.13)],Ego autem cum mihi molesti essent; induebar cilicio. humiliabam in ieiunio animam meam; et oratio mea in sinum meum conuerteturþonne hefige wæran ic scridde of hæron ic eaðmedde on fæstenne sawle mine & gebed min on bearm minum sy gecyrred.
[048100 (34.14)],Quasi proximum quasi fratrem nostrum sic complacebam; quasi lugens et contristatus sic humiliabarswa swa gesibbe broþor ure swa ic gelicode swa swa heofende & geunrotsod swa ic geeaðmedde.
[048200 (34.15)],Et aduersum me letati sunt et conuenerunt; congregata sunt super me flagella et ignoraui& ongean me hy blissodon & tosomne becoman swingella.
[048300 (34.16)],"Dissipati sunt, nec compuncti; temptauerunt me, subsannauerunt me subsannatione, frenduerunt super me dentibus suistostencede synd ne hy abryrde hy fandedon toþum heora."
[048400 (34.17)],Domine quando respicies? restitue animam meam a malignitate eorum; a leonibus unicam meamþonne þu gelocast eft gesete sawle mine fram yuel dædum heora fram leonum anlican mine.
[048500 (34.18)],confitebor tibi in ecclesia magna; in populo graui laudabo teic andette on haligre gesomnunga micelre on folce hefigum ic herige þe.
[048600 (34.19)],"Non supergaudeant mihi qui aduersantur michi inique; qui oderunt me gratis, et annuuunt oculisþa þe wiðerwerdiað me unrihtlice þa hatedon me orceapungum & bicnedon mid eagum."
[048700 (34.20)],Quoniam mihi quidem pacifice loquebantur; et in iracundia terre loquentes dolos cogitabantme witodlice gesibsumlice hi spæcon hy þohtan.
[048800 (34.21)],Et dilatauerunt super me os suum; dixerunt euge euge uiderunt oculi nostri& hy tobræddon muð heora hy cwædon gefeoh gesawon eagan ure.
[048900 (34.22)],Vidisti domine ne sileas; domine ne discedas a meþu gesawe ne swiga þu ne gewit þu fram me.
[049000 (34.23)],Exurge et intende iudicio meo; deus meus et dominus meus in causam meamaris & beheald dom minne god min & drihten min on þyng<../images/lbar.gif>on intingan minne.
[049100 (34.24)],Iudica me secundum iustitiam tuam domine deus meus; et non supergaudeant michidem me æfter þinre drihten god min me.
[049200 (34.25)],Non dicant in cordibus suis euge euge anime nostre; nec dicant deuorauimus eumna cweðen on heortan heora eala<../images/lbar.gif>wellawel saul ure nen cweþen hine.
[049300 (34.26)],Erubescant et reuereantur simul; qui gratulantur malis meis. induantur confusione et reuerentia; qui maligna loquntur super meablysien & arweorþien ætgædere þa þe þanciað yuelum minum syn gescrydde & arweorþunga þe mætu specað.
[049400 (34.27)],"Exultent et letentur qui uolunt iustitiam meam; et dicant semper magnificetur dominus, qui uolunt pacem serui eiusfægnien & blissien þa þe wyllað rihtwisnesse mine & cweþen symble sie gemiclod drihten þa þe wylloð sibbe þeowes his."
[049500 (34.28)],Et lingua mea meditabitur iustitiam tuam; tota die laudem tuamtunge min smeað rihtwisnesse þine ælce dæge lof þin.
[049600 (35.2)],Dixit iniustus ut delinquat in semetipso; non est timor dei ante oculos eiuscwæð se unrihtwisa he agylte on selfum him nis ege beforan eagan his.
[049700 (35.3)],Quoniam dolose egit in conspectu eius; ut inueniatur iniquitas eius ad odiumfacenfullice he dyde on gesihð his þæt unrihtwisne his hatunge.
[049800 (35.4)],Verba oris eius iniquitas et dolus; noluit intelligere ut bene ageretword muðes his unrihtwisnes & facn he nolde ongitan þæt he wel dyde.
[049900 (35.5)],"Iniquitatem meditatus est in cubili suo; astitit omni uiae non bone, malitiam autem non odiuitunrihtwisnesse he smeade on incleofe his he ætstod ælcum wege na godum yfelnesse na he hatode."
[050000 (35.6)],Domine in celo misericordia tua; et ueritas tua usque ad nubeson heofone mildheortnes & soðfæstnes þin oð to genipum.
[050100 (35.7)],Iustitia tua sicut montes dei; iudicia tua abyssus multa. homines et iumenta saluabis dominerihtwisnes þin swa swa muntas domas þin deopnes felafeald men & nytenu.
[050200 (35.8)],quemadmodum multiplicasti misericordiam tuam deus. filii autem hominum; in tegmine alarum tuarum sperabuntswa swa þu gemænigfyldest bearn manna fyðera þinra hyhtað.
[050300 (35.9)],Inebriabuntur ab ubertate domus tue; et torrente uoluptatis tue potabis eosbeoð druncnude of genihtsumnisse huses þine & of burnan willan þines þu drencst hy.
[050400 (35.10)],Quoniam apud te est fons uite; et in lumine tuo uidebimus lumenmid wille lifes on leohte we geseoð leoht.
[050500 (35.11)],Pretende misericordiam tuam scientibus te; et iustitiam tuam his qui recto sunt cordeastrece<../images/lbar.gif>þe mildheortnesse þine witendum þe & rihtwisnesse þam þe rihtwisse heortan.
[050600 (35.12)],Non ueniat mihi pes superbie et manus peccatoris non moueat mene cume me fot ofermodnisse & hand ne astirige me.
[050700 (35.13)],Ibi ceciderunt qui operantur iniquitatem; expulsi sunt nec potuerunt stareþær hruron<../images/lbar.gif>feollon þe wyrcað unrihtwisnesse ut acnyssed hy sind ne hi mihton standan.
[050800 (36.1)],Noli emulari in malignantibus; neque zelaueris facientes iniquitatemnelle þu onhyrian betwox þa awyrgendan ne þu ne anda þa dondan unrihtwisnesse.
[050900 (36.2)],Quoniam tanquam fenum uelociter arescent; et quemadmodum olera herbarum cito decidentswa swa heg hrædlice hi adrugiað bleda wyrta raðe hreosað.
[051000 (36.3)],Spera in domino; et fac bonitatem; et inhabita terram et pasceris in diuitiis eiusgehyht & do godnisse earda eorðan & þu bist fed on welum hire.
[051100 (36.4)],Delectare in domino; et dabit tibi petitiones cordis tuigelustfulla on drihten & he sylþ þe girninge heortan <þines>.
[051200 (36.5)],Reuela domino uiam tuam; et spera in eo et ipse facietawreoh drihten weg þinne & hyht on hyne & he deþ.
[051300 (36.6)],"Et educet quasi lumen iustitiam tuam, et iudicium tuum tanquam meridiem& he gelædeð leoht rihtwisnesse þine & dom þinne middæg."
[051400 (36.7)],subditus esto domino et ora eum. noli emulari in eo qui prosperatur in uia sua; in homine faciente iniustitiasunderþeod beo þu drihtne he bið gesundfullod on wege his on men dondum unrihtwisnesse.
[051500 (36.8)],Desine ab ira et derelinque furorem. noli emulari ut malignerisablin fram yrre & forlæt hatheortnesse.
[051600 (36.9)],Quoniam qui malignantur exterminabuntur; sustinentes autem dominum ipsi hereditabunt terrambeoð geteorode hy eorðan.
[051700 (36.10)],"Et adhuc pusillum et non erit peccator; et queres locum eius, et non inuenies& nu gyt lytelfæc bið synful & secst stowe his & na þu gemetst."
[051800 (36.11)],Mansueti autem hereditabunt terram; et delectabuntur in multitudine pacisþa geþwæran eorþan & gelustfulliað on mænigfealdnisse sibbe.
[051900 (36.12)],Obseruabit peccator iustum; et stridebit super eum dentibus suisbegimð se synfulla riht ofer hine toþum his.
[052000 (36.13)],Dominus autem irridebit eum; quonium prospicit quod ueniet dies eiusonhyscð he foresceawað þæt cumeð dæg his.
[052100 (36.14)],Gladium euaginauerunt peccatores; intenderunt arcum suum. vt decipiant pauperem et inopem; ut trucident rectos cordesweord of sceaðe atugon þa synfullum hy aþenedon bogan heora þæt hy awyrpen ut þearfan & unmagan þæt hy cwylmen rihtwise on heorte.
[052200 (36.15)],Gladius eorum intret in corda ipsorum; et arcus eorum confringatursweord heora inga on heortan heora & boga heora.
[052300 (36.16)],Melius est modicum iusto; super diuitias peccatorum multasbetere is medmicel þam rihtwisan ofer welan synna mænige.
[052400 (36.17)],Quoniam brachia peccatorum conterentur; confirmat autem iustos dominusearmas synfulra beoð tobrocene a getrymeþ rihtwise drihten.
[052500 (36.18)],Nouit dominus dies immaculatorum; et hereditas eorum in<../images/etail.gif>ternum eritcan drihten onweamendra & yrfeweardnis heora on ecnesse bið.
[052600 (36.19)],"Non confundentur in tempore malo, et in diebus famis saturabunturna hy beoð gescynde on tide yfelre & on dagum hungres hy beoð fyllede."
[052700 (36.20)],quia peccatores peribunt. inimici uero domini mox honorificati fuerint et exaltati; deficientes quemadmodum fumus deficientsynfulle forwyrþað fynd sona gearwurþode beoð & upahafene geteriende smic hy geteoriað.
[052800 (36.21)],Mutuabitur peccator et non soluet; iustus autem miseretur et tribuetborgað synfulla se rihtwisa agylt.
[052900 (36.22)],Quia benedicentes ei hereditabunt terram; maledicentes autem ei disperibuntbletsiende eorðan yfelcwedelginde soþlice.
[053000 (36.23)],Apud dominum gressus hominis dirigentur; et uiam eius uoletstæpas mannes beoð gerihte & weg his.
[053100 (36.24)],cum ceciderit iustus non collidetur; quia dominus supponit manum suamþonne ahreoseþ forþan handa heora.
[053200 (36.25)],"Iunior fui etenim senui, et non uidi iustum derelictum; nec semen eius querens panemic wæs & soðlice ealdod & na ic seah rihtwisne forlætene sæd his hlaf."
[053300 (36.26)],Tota die miseretur et commodat; et semen illius in benedictione eritælce dæge hi ofearmað & lænð & sæd on bletsunge bið.
[053400 (36.27)],Declina a malo et fac bonum; et inhabita in seculum seculiahyld fram yuele & do god & onwuna aworuld.
[053500 (36.28)],"Quia dominus amat iudicium, et non derelinquet sanctos suos; in eternum conseruabuntur. iniusti punientur; et semen impiorum peribitlufað dom & na forlætet halige æfre hy beoð gehealdene unriht beoð witnode & sæd arleasra forweorþeð."
[053600 (36.29)],Iusti autem hereditabunt terram; et inhabitabunt in seculum seculi super eamrihtwise soþlice eorðan & oneardiað on woruld ofer hy.
[053700 (36.30)],Os iusti meditabitur sapientiam; et lingua eius loquetur iudiciummuþ rihtwises smeað<../images/lbar.gif>gemyneð wisdom & tunge his sprecð dom.
[053800 (36.31)],Lex dei eius in corde ipsius; et non supplantabuntur gressus eiusæe godes his on heorte him & na underplantude beoð stepas his.
[053900 (36.32)],Considerat peccator iustum; et querit mortificare eumbesceawað synfulla rihtwisne & secð hine.
[054000 (36.33)],Dominus autem non derelinquet eum in manibus eius; non dampnabit eum cum iudicabitur illisoðlice na forlæteþ hine on handum his na genyðreð hine þonne demed byð him.
[054100 (36.34)],"Expecta dominum et custodi uiam eius; et exaltabit te ut hereditate capias terram, cum perierint peccatores uidebisgeanbida drihten & geheald weg his & he upahefð þe eorðe þonne forweorðað synfulle þu ge."
[054200 (36.35)],"Vidi impium superexaltatum, et eleuatum; sicut cedros libaniic geseah arleasne ofer & upahafenne cedar treow."
[054300 (36.36)],"Et transiui, et ecce non erat; quesiui eum, et non est inuentus locus eius& ic ofereode ongihðe he nes<../images/lbar.gif>na wæs & ic sohte hine na is<../images/lbar.gif>nis gemet stow his."
[054400 (36.37)],Custodi innocentiam et uide equitatem; quoniam sunt reliquie homini pacificogeheald geseoh efennisse synd lafa menn gesibsumum.
[054500 (36.38)],Iniusti autem disperibunt simul; reliquie impiorum interibuntþa unrihtwisan forweorðað somod lafa arleasra.
[054600 (36.39)],salus autem iustorum a domino; et protector eorum in tempore tribulationishælo soþis rihtwisra gescyldend heora on tide geswinces.
[054700 (36.40)],"Et adiuuabit eos, dominus, et liberabit eos et eruet eos a peccatoribus, et saluabit eos; quia sperauerunt in eogefylsteþ hy alyseþ hy genereð hy fram synfullum hy forðon hy hyhton on hine."
[054800 (37.2)],domine ne in furore tuo argvas me; neque in ira tua corripias mena on hatheortnesse þinre þu ðreage me & na on yrrum þinum þu nerewe me.
[054900 (37.3)],quoniam sagitte tue infixe sunt mihi; et confirmasti super me manum tuamflana þina ongefæstnode synd me & þu getremedest ofer me handa þine.
[055000 (37.4)],Non est sanitas in carne mea a facie ire tue; non est pax ossibus meis a facie peccatorum meorumnis hælo on flæsce minum of ansyne eorres þines nis sibb banum minum of ansyne synna minra.
[055100 (37.5)],Quoniam iniquitates mee supergresse sunt caput meum; et sicut onus graue grauate sunt super meonrihtwisnessa ofer heafod min swa swa byrðen hefig gehefegode synd ofer me.
[055200 (37.6)],Putruerunt et corrupte sunt cicatrices mee; a facie insipientie meerotode & hi gemmede synd dolhswaðo mine of ansiene unwisdomes mines.
[055300 (37.7)],Miser factus sum et curuatus sun usque in finem; tota die contristatus ingrediebaroð ende ælce dæge geunrotsod ic ineode.
[055400 (37.8)],Quoniam lumbi mei impleti sunt illusionibus; et non est sanitas in carne meabismrungum na is hælo on flæsce minum.
[055500 (37.9)],Afflictus sum et humiliatus sum nimis; rugiebam a gemitu cordis meigeeaðmed ic grymetede of geomrunge heortan mine.
[055600 (37.10)],Domine ante te omne <desiderium> meum; et gemitus meus a te non est <absconditus>beforan eall gewilnung min geomrung min fram þe nis behydd.
[055700 (37.11)],"Cor meum conturbatum est, dereliquit me uirtus mea; et lumen oculorum meorum et ipsum non est mecummin gedrefed is forlæt min leoht eagana minra nis mid me."
[055800 (37.12)],Amici mei et proximi mei; aduersum me appropinquauerunt et steterunt. et qui iuxta me erant de longe steteruntfrynd mine & magas ongean me genealehton stodon.
[055900 (37.13)],et uim faciebant qui querebant animam meam. et qui inquirebant mala michi loquti sunt uanitates; et dolos tota die meditabanturnyd dydon þa þe sohton sawle mine þa sohton yuelu me hi spræcon ydelnesse facn ælce dæge hy smeadon.
[056000 (37.14)],Ego autem tanquam surdus non audiebam; et sicut mutus non aperiens os suumsoðlice swa swa deaf na ic gehyrde swa swa dumb na atynde muð his.
[056100 (37.15)],Et factus sum sicut homo non audiens; et non habens in ore suo redargutiones& geworden ic eom swa swa man na gehyrde & na libbende on muðe his.
[056200 (37.16)],Quoniam in te domine speraui; tu exaudies domine deus meuson ðe ic hyhte þu gehyrst.
[056300 (37.17)],"Quia dixi nequando supergaudeant mihi inimici mei; et dum commoueantur pedes mei, super me magna loquti suntic cwæð þylæs hwonne fynd mine þonne wæron astyrede fet mine fela hy spræcon."
[056400 (37.18)],Quoniam ego in flagella paratus sum; et dolor meus in conspectu meo semperswingellum gearo ic eom sar min symle.
[056500 (37.19)],Quoniam iniquitatem meam annuntiabo; et cogitabo pro peccato meounrihtwisnesse mine ic cyþe ic þence for synne minre.
[056600 (37.20)],"Inimici autem mei uiuent; et confirmati sunt super me, et multiplicati sunt qui oderunt me iniquefynd mine liuiað synd ofer & gemenifylde þa þe hatedon."
[056700 (37.21)],Qui retribuunt mala pro bonis detrahebant mihi; quoniam sequebar bonitatemyuelu for god hy tældon me forðon.
[056800 (37.22)],Ne derelinquas ne domine deus meus; ne discesseris a mene forlæte þu ne gewite þe þu fram me.
[056900 (37.23)],Intende in adiutorium meum; domine deus salutis meebeheald on fultum minne hæle minre.
[057000 (38.2)],Dixi custodiam uias meas; ut non delinquam in lingua mea. posui ori meo custodiam; cum consisteret peccator aduersum meic cwæð ic gehealde wegas mine þæt ic ne agylte on tunga minre ic asette muð minum geheordunga þonne se synfulla ongean me.
[057100 (38.3)],"Ommutui, et humiliatus sum, et silui a bonis; et dolor meus renouatus estic adumbude geeadmed ic eom & ic swigode fram godum sar min geedniwod is."
[057200 (38.4)],Concaluit cor meum intra me; et in meditatione mea exardescet ignishatode heorte min on me smeaunge minre byrnð fyr.
[057300 (38.5)],Loqutus sum in lingua mea; notum fac michi domine finem meum. et numerum dierum meorum qui est; ut sciam quid desit mihiic spræc on <tungan> minre cuðne do me ende minne getel<../images/lbar.gif>gerim daga minra hwilc is þæt ic wite hwæt wana sie me.
[057400 (38.6)],Ecce mensurabiles posuisti dies meos; et substantia mea tanquam nichilum ante te. Ueruntamen uniuersa uanitas; omnis homo uiuensþe settest dagas mine & sped min swa swa beforan þe þeah hwæþere eall idelnis ælc man <liuiende>.
[057500 (38.7)],Veruntamen in imagine pertransit homo; sed et frustra conturbatur. thesaurizat; et ignorat cui congregabit eaon anlicnesse man he goldhordaþ & nat hwam he somnað þa.
[057600 (38.8)],Et nunc que est expectatio mea? nonne dominus? et substantia mea apud te est& nu hwylc is anbidung min hunenu sped min is.
[057700 (38.9)],Ab omnibus iniquitatibus meis erue me; opprobrium insipienti dedisti mefram eallum unrihtwisnessum minum nere me hosp unwisum þu sealdest me.
[057800 (38.10)],Ommutui et non aperui os meum quoniam tu fecistiic adumbude & na ic atynde muð minne þu dydest.
[057900 (38.11)],amoue a me plagas tuasastyre fram me witu þine.
[058000 (38.12)],A fortitudine manus tue ego defeci in increpationibus; propter iniquitatem corripuisti hominem. et tabescere fecisti sicut araneam animam eius; ueruntamen uane conturbatur omnis homofram strengo handa þinre ic geteorode on þeangum<../images/lbar.gif>steorum fore unrihtwisnesse þu nyrwdest mann þu dydest sawle his þeah hwæðre ælc man.
[058100 (38.13)],"Exaudi orationem meam domine, et deprecationem meam; auribus percipe lacrimas meas. ne sileas, quoniam aduena ego sum apud te; et peregrinus sicut omnes patres meigehyr gebed min mid earum onfoh tearas mine wrecca ic eom nid þe & elþeodig swa swa ealle fæderas mine."
[058200 (38.14)],Remitte mihi ut refrigerer priusquam abeam; et amplius non eroforlæt me þæt ic gecele ærþam þe & ma ic ne beo.
[058300 (39.2)],Expectans expectaui dominum; et intendit michigeanbidiende ic anbad drihten.
[058400 (39.3)],Et exaudiuit preces meas; et eduxit me de lacu miserie et de luto fecis. Et statuit supra petram pedes meos; et direxit gressus meos& he gehyrde & he gelædde of seaðe yrmþe & of fenne drosna & he gesette ofer stan fet mine & he gerehte stæpas mine.
[058500 (39.4)],Et immisit in os meum canticum nouum; carmen deo nostro. videbunt multi et timebunt; et sperabunt in domino& he onsende on muþ minne cantic niwne gode urum geseoþ monige & ondrædað gehihtað.
[058600 (39.5)],Beatus uir cuius; est nomen domini spes eius et non respexit in uanitates et insanias falsaseadig wer þæs þe is nama hyht his na beseah on ydelnessa swæceheow lease.
[058700 (39.6)],Multa fecisti tu domine deus meus mirabilia tua; et cogitationibus tuis non est qui similis sit tibi. annuntiaui et loqutus sum; multiplicati sunt super numerumfela þu dydest þu wundru & geþohtum þinum nis hwelc gelic si þe ic cyþde & ic spræc gemænigfylde synd ofer gerim.
[058800 (39.7)],Sacrificium et oblationem noluisti; aures autem perfecisti mihi. holocaustum et pro peccato non postulastionsægdnesse & ofletan þu noldest soðlice þu fulfremedest me onsægnissa na þu bæde.
[058900 (39.8)],"tunc dixi, ecce uenio. in capite libri scriptum est de meþonne ic sæde onsæde ic cume on heafde boces awriten is be me."
[059000 (39.9)],"ut facerem uoluntatem tuam; deus meus uolui, et legem <tuam> in medio cordis meiþæt ic do willan þinre god ic wolde & æe on middele heortan mine."
[059100 (39.10)],Annuntiaui iustitiam tuam in ecclesia magna; ecce labia mea non proibebo domine tu scistiic bodude rihtwisnesse þinre ongesihðe weleras mine <na> ic forbeode.
