id,text
[137900 (87.19)],Elongasti a me amicum et proximum; et notos meos a miseriaðu ascihtest freond & nyhstan & cuðe mine fram yrmðe.
[138000 (88.2)],Misericordias domini; in eternum cantabo. in generatione et generatione; annuntiabo ueritatem tuam in ore meomildheortnessa on ecnesse ic singe on cynrene ic bodige soþfæstnesse on muþe minum.
[138100 (88.3)],Quoniam dixisti in eternum misericordia edificabitur in celis; preparabitur ueritas tua in eisþu cwæde on ecnesse mildheortnes bið getimbred on heofonum biþ gegearwod soþfæstnes.
[138200 (88.4)],Disposui testamentum electis meis; iuraui david seruo meoic tosette cyþnesse gecorenum minum ic swor þeowe minum.
[138300 (88.5)],usque in eternum preparabo semen tuum. et edificabo in generatione et gene;ratione sedem tuamoþ on ecnesse ic gearwige sæd þin & ic timbrie setl þin.
[138400 (88.6)],Confitebuntur celi mirabilia tua domine; etenim ueritatem tuam in ecclesia sanctorumgeandettað heofonas wundru þine soþfæstnisse þine on gesomnung haligra.
[138500 (88.7)],Quoniam quis in nubibus equabitur domino? similis erit domino in filiis deihwilc on genipum bið geefenlæced gelic bið on bearn godes.
[138600 (88.8)],Deus qui glorificatur in consilio sanctorum; magnus et terribilis super omnes qui in circumitu eius suntþe bið gewuldrud on geþeahte haligra micel & egeslic ealle þe on ymbhwyrfte his his synt.
[138700 (88.9)],Domine deus uirtutum quis similis tibi? potens es domine et ueritas tua in circumitu tuomægena hwilc gelic þe rice & soþfæstnis þin on ymbhwyrfte þinum.
[138800 (88.10)],Tu dominaris potestatis maris; motum autem fluctuum eius tu mitigasþu wyldst anwealdu sæs gewilc yþa his þu liðgast.
[138900 (88.11)],Tu humiliasti sicut uulneratum superbum; in brachio uirtutis tue dispersisti inimicos tuosþu geniþrodest swa swa gewundodne ofermodne þu tostenctest fynd þine.
[139000 (88.12)],"Tui sunt celi, et tua est terra; orbem terre et plenitudinem eius tu fundastiþine sind heofonas & þin is eorðe ymbhwyrft eorðan & fyllednesse his þu gestaþelodest."
[139100 (88.13)],"aquilonem et mare tu creasti. tabor, et hermon, in nomine tuo exultabuntnorðdæl & sæ þu gesceope on naman þinum hy uphebbað."
[139200 (88.14)],tuum brachium cum potentia. firmetur manus tua et exaltetur dextera tuaþinne earm mid mihte sy getrymed hand þin & sy upahafen seo swiþre þin.
[139300 (88.15)],iustitia et iudicium preparatio sedis tue. misericordia et ueritas precedent faciem tuamrihtwisnes & dom gegearwung setles þines mildheortnes & soþfæstnis foregaþ ansine þine.
[139400 (88.16)],beatus populus qui scit iubilationem. domine in lumine uultus tui ambulabunteadig folc þe wat wyndream on leohte andwlitan þynes.
[139500 (88.17)],"et in nomine tuo exultabunt tota die, et in iustitia tua exaltabuntur& on naman þinum hy blissiaþ ælce dæg & on rihtwisnesse þinre hy beoð upahafene."
[139600 (88.18)],Quoniam gloria uirtutis eorum tu es; et in beneplacito tuo exaltabitur cornu nostrumwuldor mægenes heora þu eart & on gecweminge þinre bið upahafen horn ure.
[139700 (88.19)],Quia domini est assumptio nostra; et sancti israhel regis nostriforðon drihtnes is anfeng & haliges cyninges ures.
[139800 (88.20)],"Tunc locutus es in uisione sanctis tuis et dixisti; posui adiutorium in potente, et exaltaui electum de plebe meaþa þu spræce on gesihþe þinum & þu cwæde ic asette fultum on ricne & ic upahof gecorenne of folce minum."
[139900 (88.21)],Inueni david seruum meum; oleo sancto meo unxi eumic funde þeow minne ele halgum minum ic smerede hine.
[140000 (88.22)],Manus enim mea auxiliabitur ei et brachium meum confirmabit eumhand min fylsteþ him & earm min gestrangað hine.
[140100 (88.23)],Nichil proficiet inimicus in eo; et filius iniquitatis non apponet nocere eumnaht framað feond on him & bearn unrihtwisnesse.
[140200 (88.24)],Et concidam a facie ipsius ininicos eius; et odientes eum in fugam conuertam& ic afylle fram asiene fynd his & fænde hine on fleam ic gecyrre.
[140300 (88.25)],Et ueritas mea et misericordia mea cum ipso; et in nomine meo exaltabitur cornu eius& soðfæstnes min & mildheortnis min mid him & on naman minum bið upahafen horn his.
[140400 (88.26)],Et ponam in mari manum eius; et in fluminibus dexteram eiusic asette on sæ hand his & on flodum þa swiþran his.
[140500 (88.27)],"Ipse inuocabit me pater meus es tu; deus meus, et susceptor salutis meehe gecigde me fæder min & andfeng hæle mine."
[140600 (88.28)],Et ego primogenitum ponam illum; excelsum pr<../images/etail.gif>regibus terr<../images/etail.gif>& ic cennedne ic sette hine fore cyningum eorðan.
[140700 (88.29)],In eternum seruabo illi misericordiam meam; et testamentum meum fidele ipsion ecnesse ic healde him mildheortnesse mine & cyðnesse mine getriwum him.
[140800 (88.30)],Et ponam in seculum seculi semen eius; et thronum eius sicut dies caeli& ic sette aworuld his & heahsetl his swa swa dagas heofones.
[140900 (88.31)],Si autem dereliquerint filii eius legem meam; et in iudiciis meis non ambulauerintgif hy forlætað sunu his æ mine & on domum minum na ongað.
[141000 (88.32)],Si iustitias meas profanauerint; et mandata mea non custodierintgif rihtwisnessa mine wemmað<../images/lbar.gif>agælað & bebodu mine ne healdað.
[141100 (88.33)],Visitabo in uirga iniquitates eorum; et in uerberibus omnia peccata eorumic neosige on gyrde unrihtnessa heora & on swingellum synna heora.
[141200 (88.34)],Misericordiam autem meam non dispergam ab eo; neque nocebo in ueritate meamildheortnes soðlice mine na ic tostrede fram him & na ic scæþe on soþfæstnesse minre.
[141300 (88.35)],Neque prophanabo testamentum meum; et que procedunt de labiis meis non faciam irrita& na ic agæle cyðnesse mine & þa þe forðgewitaþ of welerum minum na ic do hospula.
[141400 (88.36)],"Semel iuraui in sancto meo, si david mentiaræne ic swor on haligum minum ne ic leoge."
[141500 (88.37)],semen eius in eternum manebitsæd his on ecnesse wunaþ.
[141600 (88.38)],"Et thronus eius sicut sol in conspectu meo, et sicut luna perfecta in eternum; et testis in celo fidelisswa swa sunna on gesihþe minre mona fulfremed on ecnesse & gewita on heofone getrywe."
[141700 (88.39)],Tu uero repulisti et despexisti; distulisti cristum tuumþu soþlice anyddest ðu yldest tobræddest þinne.
[141800 (88.40)],Euertisti testamentum serui; tui profanasti in terra sanctuarium eiusþu acyrdest cyþnesse þeowes þines þu gewemdest on eorðan his.
[141900 (88.41)],Destruxisti omnes sepes eius; posuisti firmamentum eius formidinemþu towurpe ealle his þu gsettest.
[142000 (88.42)],Diripuerunt eum omnes transeuntes uiam; factus est opprobrium uicinis suisreafodon hine ealle oferfarene weg geworden is hosp neahgeburum his.
[142100 (88.43)],Exaltasti dexteram deprimentium eum; letificasti omnes inimicos eiusþu upahofe his þu blissodest ealle fynd his.
[142200 (88.44)],Auertisti audiutorium gladii eius; et non es auxiliatus ei in belloþu acyrdest fultum sweordes his & nære gefylsted him on gefeohte.
[142300 (88.45)],Destruxisti eum ab emundatione; et sedem eius in terra collisistihine fram clæsnunga & setl his on eorþan þu forgnide.
[142400 (88.46)],Minorasti dies temporis eius; perfudisti eum confusioneþu wanodest dagas tide his þu ðurhgute gedrefednesse.
[142500 (88.47)],Vsquequo domine auertis in finem? exardescet sicut ignis ira tuahu lange on ende byrnð swa swa fyr eorre.
[142600 (88.48)],"Memorare que mea substantia, nunquid enim uane constituisti omnes filios hominumgemun hwylc min sped soþlice on gemear þu gesettest ealle sunu manna."
[142700 (88.49)],Quis est homo qui uiuet et non uidebit mortem; eruet animam suam de manu inferihwilc is man þe leouað & na gesihð deað nereþ saule his of handa.
[142800 (88.50)],Vbi sunt misericordie tue antique domine; sicut <iurasti> dauid in ueritate tuahwær synd mildheornessa þine ealde swa swa þu swore on soþfæstnesse þinre.
[142900 (88.51)],Memor esto domine opprobrii seruorum tuorum; quod continui in sinu neo multarum gentiumgemyndig beo ðu hospes þeowra þinra þonne ic behæfde on bearme manigra þeoda.
[143000 (88.52)],Quod exprobauerunt inimici tui domine; quod exprobauerunt commutationem christi tuiþone hyspton fynd þine drihten gehwearf.
[143100 (88.53)],"Benedictus dominus in eternum fiat, fiatgebletsod on ecnesse."
[143200 (89.1)],Domine refugium factus es nobis; a generatione in generationemdrihten frofr geworden us.
[143300 (89.2)],Priusquam montes fierent et formaretur terra et orbis; a seculo et usque in seculum tu es deusærþam muntas þe wæren gehiwod wære eorðe & ymbhwyrftes fram worulde & oþ on woruld þu eart.
[143400 (89.3)],"Ne auertas hominem in humilitatem; et dixisti, conuertimini filii hominumne acyr þu man on geniþerunga & þu cwæde gecyrrað suna manna."
[143500 (89.4)],Quoniam mille anni ante oculos tuos; tanquam dies hesterna que preteriit. et custodia in nocteþusend geara beforan eagan þine swa swa dæg gystra þe forsceoc & heordnes on nihte.
[143600 (89.5)],que pro nichilo habentur eorum anni eruntseo for naht sind hæfde heora gear.
[143700 (89.6)],"Mane sicut herba transeat, mane floreat et <transeat>; uespere decidat induret et arescaton mergen swa wyrt gewiteð bloweð & <fareð> on æfen afylþ astiþaþ & adruwað."
[143800 (89.7)],Quia defecimus in ira tua; et in furore tuo turbati sumusforðon we geteorodon on eorre þinum & on hatheortnes þine gedrefed we synd.
[143900 (89.8)],Posuisti iniquitates nostras in conspectu tuo; seculum nostrum in illuminatione uultus tuiþu asettest unrihtwisnessa ura on gesihþe þinre worulde ure on alyhtnessa.
[144000 (89.9)],Quoniam omnes dies nostri defecerunt; et in ira tua defecimus. anni nostri sicut aranea meditabunturealle dagas ure geteorodon & on eorre þinum we geteorodon gear ure swa swa renge smeadon.
[144100 (89.10)],dies annorum nostrorum in ipsis septuaginta annis. si autem in potentatibus octoginta anni; et amplius eorum labor et dolor. quoniam superuenit mansuetudo; et corripiemurdagas <geara> ura on þam hundseofantigum gearum gif soðlice on anwealdum hundeahtatig geara & ma heora geswinc & sar com manþwærnes & we beoð þread.
[144200 (89.11)],Quis nouit potestatem ire tue? et pre timore tuo iram tuamhwylc cann anweald yrres þines & for ege þinum yrre þin.
[144300 (89.12)],dinumerare? dexteram tuam sic notam fac; et eruditos corde in sapientiagetellan þa swiþran þine cvðe do & gelærede heortan on wisdome.
[144400 (89.13)],Conuertere domine usquequo? et deprecabilis esto super seruos tuosgecyr ofer þeowas þine.
[144500 (89.14)],Repleti sumus mane misericordia tua; et exultauimus et delectati sumus in omnibus diebus nostrisgefyllede we sind o mergen of mildheortnesse þinre & we blissodon & we gelustfullodon on eallum dagum urum.
[144600 (89.15)],Letati sumus pro diebus quibus nos humiliasti annis quibus uidimus malafore dagum on þam us þu geeaþmeddest gearum on þam we gesawon yfelu.
[144700 (89.16)],"Respice in seruos tuos et in opera tua, et dirige filios eorumgeloca on þeowas þine & on weorc þin gerece suna heora."
[144800 (89.17)],"Et sit splendor domini dei nostri super nos; et opera manuum nostrarum dirige super nos, et opus manuum nostrarum dirige& sie beortnes ures ofer us & weorc handa ura gerece ofer us."
[144900 (90.1)],Qui habitat in adiutorio altissimi; in protectione dei celi commorabiturse eardað on fultume þæs hyhstan on gescyldnesse heofones he wunað.
[145000 (90.2)],"Dicet domino, susceptor meus es tu et refugium meum deus meus; sperabo in eumhe cwið andfeng min & frofr min god min ic hyhte on hine."
[145100 (90.3)],Quoniam ipse liberabit me de laqueo uenantium; et a uerbo asperohe alysde me of grine hungendra &.
[145200 (90.4)],scapulis suis obumbrabit tibi; et sub pennis eius sperabiseahslum his he sceadewode & under feþerum his þu hihst.
[145300 (90.5)],Scuto circundabit te ueritas eius; non timebis a timore nocturnoof scylde ymbselþ þe soþfæstnes his na þu ondrædst fram ege nihtlicum.
[145400 (90.6)],"A sagitta uolante in die, a negotio perambulante in tenebris; ab incursu et demonio meridianofram flane fleondre fram gestreone gangendum on ðystrum & deofle suðernum."
[145500 (90.7)],"Cadent a latere tuo mille, et decem milia a dextris tuis; ad te autem non appropinquabithy feallað fram sidan þinre þusend & tyn þusenda fram swiþrun þinum na genealeacð."
[145600 (90.8)],Veruntamen oculis tuis considerabis; et retributionem peccatorum uidebishwæþere þeah eagum þinum þu besceawast & edlean synna þu gesihst.
[145700 (90.9)],Quoniam tu es domine spes mea; altissimum posuisti refugium tuumþu eart hyht min heahstne þu gesettest frofr þinne.
[145800 (90.10)],Non accedet ad te malum; et flagellum non appropinquabit tabernaculo tuona togenealæcað to þe yfel & swingel genealæcð eardungstowe þinum.
[145900 (90.11)],Quoniam angelis suis mandauit de te; ut custodiant te in omnibus uiis tuisenglum his bebead be þe þæt hy healden þe on eallum wegum þinum.
[146000 (90.12)],In manibus portabunt te; ne forte offendas ad lapidem pedem tuumon handum hy berað þe þu oþspurne æt stane fot þinne.
[146100 (90.13)],Super aspidem et basiliscum ambulabis; et conculcabis leonem et draconemofer nædran & nædran þu gæst & þu fortrydest leon & dracan.
[146200 (90.14)],Quoniam in me sperauit liberabo eum; protegam eum quoniam cognouit nomen meumon me he hyhte ic alyse hine ic gescylde he ancnew naman min.
[146300 (90.15)],"Clamauit ad me et exaudiam eum; cum ipso sum in tribulatione, eripiam eum et glorificabo eum& ic gehyre me mid him ic eom on geswince ic generige & ic gewuldrige hine."
[146400 (90.16)],Longitudine dierum replebo eum; et ostendam illi salutare meumlangnesse daga ic gefylle hine & ic oðiwe him hælo mine.
[146500 (91.2)],Bonum est confiteri domino; et psallere nomini tuo altissimegod is andettan & singan naman þinum þu hehsta.
[146600 (91.3)],Ad annuntiandum mane misericordiam tuam; et ueritatem tuam per noctemto bodianne on mergen mildheortnes þine & soðfæstnesse þine þurh niht.
[146700 (91.4)],In decacordo psalterio; cum cantico in cytharaon tynstrengedum saltere mid cantice on hearpan.
[146800 (91.5)],Quia delectasti me domine in factura tua; et in operibus manuum tuarum exultaboforðon þu gebliþgodest me on geweorce þinum & on weorcum handa þinra ic blissige.
[146900 (91.6)],Quam magnificata sunt opera tua domine; nimis profunde facte sunt cogitationes tuehu gemiclode synd weorcu þine swiðe deope gewordene synd geþohtas þine.
[147000 (91.7)],Vir insipiens non cognoscet; et stultus non intelleget hecwer unwis na oncnawþ & dysig na ongit þa.
[147100 (91.8)],cum exorti fuerint peccatores sicut fenum; et apparuerint <omnes> qui operantur iniquitatemswa swa hyg & oðeowden ealle þa þe weorcað unriht.
[147200 (91.9)],vt intereant in seculum seculi; tu autem altissimus in eternum domineþæt hy forwyrðan on worulde worulda þu soþlice þe hehsta on ecnesse.
[147300 (91.10)],"Quoniam ecce inimici tui domine, quoniam ecce inimici tui peribunt; et dispergentur omnes qui operantur iniquitatemongesihþe fynd þine foreweorðað & beoð togedræfed ealle þa þe wyrcaþ unriht."
[147400 (91.11)],Et exaltabitur sicut unicornis cornu meum; et senectus mea in misericordia uberi& bið uphafen swa swa anhyrnede horn min & yld min on mildheortnesse genihtsumre.
[147500 (91.12)],Et despexit oculus meus inimicos meos; et insurgentibus in me malignantibus audiet auris mea& geseah eage min fynd mine & onarisende on me wyrgende gehyrde eare min.
[147600 (91.13)],Iustus ut palma florebit; ut cedrus libani multiplicabitur<rihtwis> swa palmtwig bloweð swa swa cederbeam byþ gemænig.
[147700 (91.14)],Plantati in domo domini; in atriis domus dei nostri florebuntplantode on huse on cafertunum ures blowaþ.
[147800 (91.15)],Adhuc multiplicabuntur in senecta uberi; et bene patientes eruntnu git beoð gemænigfyld on hylde genihtsumre & wel þyldgende hy beoþ.
[147900 (91.16)],ut annuntient. quoniam rectus dominus deus noster; et non est iniquitas in eoþæt hy cyþen & nis unrihtwisnes on him.
[148000 (92.1)],"Dominus regnauit, decorem indutus est; indutus est dominus fortitudinem; et precinxit se. etenim firmauit orbem terre; qui non conmouebiturricsode wlite gescryd strangnisse & he begyrde hine & soþlice he getrymede ymb eorðan þe na byþ astyred."
[148100 (92.2)],Parata sedes tua ex tunc; a seculo tu es. eleuauerunt flumina domine; eleuauerunt flumina uocem suamgearo setl þin siðþan fram worulde þu eart upahofon flodas stæfna heora.
[148200 (92.3)],Eleuauerunt flumina fluctus suos.
[148300 (92.4)],a uocibus aquarum multarum. mirabiles elationes maris; mirabilis in altis dominusfram stefnum wætera manigra wuldurlica ahafennissa sæs wuldurlic on heanessum.
[148400 (92.5)],Testimonia tua credibilia facta sunt nimis; donum tuam decet sanctitudo domine in longitudinem dierumcyðnessa þine geleaffullicra gewordene sind swiþe huse þinum gerisaþ halige on langnesse daga.
[148500 (93.1)],Deus ultionum dominus; deus ultionum libere egitwraca drihten freolice dyde.
[148600 (93.2)],Exaltare qui iudicas terram; redde retributionem superbisahefe þu þe demst eorðan gyld edlean ofermodum.
[148700 (93.3)],Vsquequo peccatores domine; usquequo peccatores gloriabunturhu lange synfulle wuldriað.
[148800 (93.4)],Effabuntur et loquentur iniquitatem loquentur omnes qui operantur iniustitiam& sprecað unrihtwisnesse sprecað ealle þa ðe wyrcað unrihtwisnesse.
[148900 (93.5)],Populum tuum domine humiliauerunt; et hereditatem tuam uexaueruntfolc þin hy nyþeredon & yrfeweardnesse þine hy drehton.
[149000 (93.6)],Viduam et aduenam interfecerunt; et pupillos occideruntwydewan & wreccan hy ofslogan & steopcyld hy cwealdon.
[149100 (93.7)],"Et dixerunt, non uidebit dominus; nec intelleget deus iacob& hy cwædon na gesihð na angit."
[149200 (93.8)],Intelligite insipientes in populo; et stulti aliquando sapiteongytað unwise on folce & dysige æt suman cyrre angytað.
[149300 (93.9)],Qui plantauit aurem non audiet? aut qui finxit oculum non consideratse þe þreaþ eare na he gehyrð oððe se þe hywude eagan na he besceawað.
[149400 (93.10)],Qui corripit gentes non arguet? qui docet hominem scientiamse þe þreað þeoda na neirwð he se lærð man ingehyd.
[149500 (93.11)],Dominus scit cogitationes hominum; quoniam uane suntdrihten wat geþohtas manna ydele hy sind.
[149600 (93.12)],Beatus homo quem tu erudieris domine; et de lege tua docueris eumeadig man þone þu lærst & þe æ þinre lærst hyne.
[149700 (93.13)],Vt mitiges eum a diebus malis; donec fodiatur peccatori foueafram dagum yuelum oð beo adolfen þam synfullan seaþ.
[149800 (93.14)],Quia non repellet dominus plebem suam; et hereditatem suam non derelinquetforðon na anydeð folc his & yrfeweardnisse his na he forlætað.
[149900 (93.15)],Quoadusque iustitia conuertatur in iudicium; et qui iuxta illam? omnes qui recto sunt cordeoð hwæt rihtwisnes byþ gecyrred on dom ealle þa rihte synd of heortan.
[150000 (93.16)],Quis consurget mihi aduersus malignantes? aut quis stabit mecum aduersus operantes iniquitatemhwilc ariseþ me ongean awyrgede oþþe hwilc standeþ mid me ongean wyrcende unrihtwisnesse.
[150100 (93.17)],Nisi quia dominus adiuuit me; paulominus habitasset in inferno anima meanimþe forþon gefylst me fornean lytlelæs eardode on helle saul min.
[150200 (93.18)],si dicebam motus est pes meus; misericordia tua domine adiuuabat megif ic cweð astyred is fot min mildheortnes þin gefylsteþ me.
[150300 (93.19)],Secundum multitudinem dolorum meorum in corde meo; consolationes tue letificauerunt animam meamæfter mænigo sara minra on heortan minre frofra þine geblissodon saule mine.
[150400 (93.20)],Nunquid adheret tibi sedes iniquitatis; qui fingis dolorem in preceptocwistu geþeodeþ þe setl unrihtwisnesse þu þe hiwast on bebode.
[150500 (93.21)],Captabunt in animam iusti; et sanguinem innocentem condempnabunthy gehæftaþ on saule rihtwises & blod unscyldig hi niþeriaþ.
[150600 (93.22)],Et factus est mihi dominus in refugium; et deus meus in adiutorium spei meae& geworden is me hyhte minum.
[150700 (93.23)],"Et reddet illis iniquitatem ipsorum, et in malitia eorum disperdet eos; disperdet illos dominus deus noster& agylt unrihtwisnessa heora & on yfelnesse heora forleoseþ hy hy drihten god ure."
[150800 (94.1)],Venite exultemus domino; iubilemus deo salutari nostrocumaþ uton blissian drihtne uton dryman gode hælende urum.
[150900 (94.2)],Preoccupemus faciem eius in confessione; et in psalmis iubilemus eiwe ofþriccen ansyne hys on andetnesse & on sealmum we dryman hin.
[151000 (94.3)],Quoniam deus magnus dominus; et rex magnus super omnes deosmicel & cyning mære ofer ealle godas.
[151100 (94.4)],Quia in manu eius sunt omnes fines terre; et altitudines montium ipsius suntforðon on handa his endas eorðan & heahnessa munta his.
[151200 (94.5)],Quoniam ipsius est mare et ipse fecit illud; et sicca manus eius formauerunthis sæ & he worhte hy & handa his.
[151300 (94.6)],"Venite adoremus, et procidamus, et ploremus ante dominum qui fecit noscumað uton gebiddan & utan aþenian & we wepen þe worhte us."
[151400 (94.7)],quia ipse est deus noster. et nos populus pascue eius; et oues manus eiusforðon he is god ure & we folc fostornoþes his & sceap his.
[151500 (94.8)],Hodie si uocem eius audieritis; nolite obdurare corda uestratodæg gif stæfne his ge gehyrað nellen ge wiðheardian heortan eowra.
[151600 (94.9)],sicut in irritatione; secundum diem temptationis in deserto. vbi temptauerunt me patres uestri; probauerunt et uiderunt opera measwa swa æfter dæge costunge on westenne þær costodon<../images/lbar.gif>fandodon me fæderas eowre hy fandodon & gesawon weorc min.
[151700 (94.10)],Quadraginta annis offensus fui generationi illi; et dixi semper errant cordefeowertigum gearum cneoresse & ic cweþ symble dwelegaþ heortan.
[151800 (94.11)],"Et isti non cognouerunt uias meas; ut iuraui in ira mea, si intrabunt in requiem meamna oncneowan wegas mines ic swor on eorre minum gyf hy inga on reste mine."
[151900 (95.1)],Cantate donimo canticum nouum; cantate domino omnis terrasingað cantic niwne eall eorþe.
[152000 (95.2)],Cantate domino et benedicite nomini eius; annuntiate de die in diem salutare eiussingað & bletsiaþ naman his.
[152100 (95.3)],Annuntiate inter gentes gloriam eius; in omnibus populis mirabilia eiusbodiaþ betweox þeoda wuldur his on eallum folcum wundru his.
[152200 (95.4)],Quoniam magnus dominus et laudabilis nimis; terribilis est super omnes deosmicel & hergendlic swiþe æþreclic ofer ealle godas.
[152300 (95.5)],Quoniam omnes dii gentium demonia; dominus autem celos fecitgodas þeoda woddreamas soþlice heofonas dyde.
[152400 (95.6)],Confessio et pulchritudo in conspectu eius; sanctimonia et magnificentia in sanctificatione eiusandetnes & fægernes on gesihðe his & miclung on halignesse his.
[152500 (95.7)],Afferte <domino> patrie gentium afferte domino gloriam et honorem; afferte domino gloriam nomini eiusbringað drihtne eþelas þeoda & arwurþunga wuldur naman his.
[152600 (95.8)],Tollite hostias et introite in atria eiusadoþ dura & gað in on cafertunas.
[152700 (95.9)],adorate dominum in atrio sancto eius. commoueatur a facie eius uniuersa terragebiddað drihten haligre his sy astyred of ansiene his eall eorðe.
[152800 (95.10)],dicite in gentibus quia dominus regnauit. etenim correxit orbem terre qui non commouebitur; iudicabit populos in equitatecweþaþ rihsode & soðlice he gerehte ymbhwyrft þe eorðe na astyred bið he demeð folc on efennesse.
[152900 (95.11)],"Letentur celi et exultet terra, commoueatur mare et plenitudo eiusblisien heofonas & upahebbe eorþe sy astyred sæ & gefyllednes his."
[153000 (95.12)],gaudebunt campi et onnia que in eis sunt. tunc exultabunt omnia ligna siluarumgefeogað feldas & þe on him sind þonne blissiað ealle treow wuda.
[153100 (95.13)],"a facie domini; quia uenit, quoniam uenit iuducare terram. iudicabit orbem terre in equitate et populos in ueritate suabeforan ansine com deman eorþan he demð ymbhwyrft eorðan on efnnesse & folc on soþfæstnesse his."
[153200 (96.1)],Dominus regnauit; exultet terra; letentur insule multedrihten rihsode gefægnie eorðe blissiaþ igland manegu.
[153300 (96.2)],Nubes et caligo in circumitu eius; iustitia et iudicium correctio sedis eiusgenipu & þycnes on ymbhwyrfte his rihtwisnes & dom gereced setles his.
[153400 (96.3)],Ignis ante ipsum precedet; et inflammabit in circumitu inimicos eiusfyr beforan foregæþ & onælþ ad iram on ymbhwyrfte fynd his.
[153500 (96.4)],Alluxerunt fulgura eius orbi terre; uidit et commota est terraonlihton ligræscas his ymbhwyrfte geseah & gedrefed is eorþe.
[153600 (96.5)],Montes sicut cera fluxerunt a facie domini; a facie domini omnis terramuntas swa swa weax fleowan of ansiene eall eorðe.
[153700 (96.6)],Annuntiauerunt celi iustitiam eius; et uiderunt omnes populi gloriam eiusbodedon heofonas riht his & gesawon ealle folcu wuldur his.
[153800 (96.7)],Confundantur omnes qui adorant sculptilia; et qui gloriantur in simulacris suis. adorate eum omnes angeli eiusasceamien ealle þe gebiddað defolgild þa þe wuldriaþ on deofolgildum heora gebiddaþ ealle englas his.
[153900 (96.8)],audiuit et letata est sion. et exultauerunt filie iude; propter iudicia tua dominehe gehyrde & geblissod is & fægnodon dohtra fore domum þinu.
[154000 (96.9)],Quoniam tu dominus altissimus super omnem terram; nimis exaltatus es super omnes deosse heahsta ofer ealle eorðan swiþe upahafen ofer ealle godas.
[154100 (96.10)],"Qui diligitis dominum odite malum; custodit dominus animas sanctorum suorum, de manu peccatoris liberabit eosge þe lufiað drihten hatiað yfel gehilt saula his of handa synfulra he alyseþ hy."
