id,text
[000100 (1)],"Confiteor tibi, domine, pater c<../images/etail.gif>li & terrae, quia ego peccator peccaui nimis coram te & coram angelis tuis sanctis & coram facie omnium sanctorum tuorum.heofonas & eorþan, forþiþe ic synful syngede swiðe toforan þe & toforan þinum halgum englum ansene."
[000200 (3)],"Peccaui per neglegentiam mandatorum tuorum per superbiam & elationem, per fornicationem & adulterium per auaritiam & uanam gloriam, per iram & tristitiam, per accidiam & somnolentiam, per inuidiam & odium, per sacrilegium & homicidium.Ic syngede þurh gemeleaste þinra beboda, þurh ofermodinesse & þurh upahafenesse, þurh forliger & þurh unrihthæmed, þurh gitsunge & þurh idel wuldor, þurh yrre & þurh unrotnesse, þurh slæwþe & þurh slapelnesse, þurh andan & þurh hatunge, þurh æbrecðe & þurh manslæht."
[000300 (7)],"Per cupiditatem & gulam, per tumorem mentis & iactantiam cordis, per furtum & rapinam, per falsum testimonium & mendacium, per detractionem & murmurationem, per ebrietatem & commessationem, per luxuriam & libidinem, per rixas & contentiones.þurh gredinesse & þurh gifernesse, þurh toðundennesse modes & þurh gelpnesse heortan, & reaflac, þurh lease kyðnesse & <leasnesse>, þurh tale & þurh murcnunge, þurh druncenesse & þurh oferæt, þurh gælsan & galnessa, þurh saka & þurh geflitu."
[000400 (11)],"Per iuramentum & maledictiones, per stultiloquium & otiosas fabulas, per pigritiam & amaritudinem, per suspicionem & susurrationem, per obliuionem & ignorantiam, per uanam letitiam & tristitiam seculi.þurh aðsware & þurh wærgolnesse, þurh stuntspæce & idele spellunga, þurh asolcennesse & þurh biternesse, þurh fæc & hwastrunge, þurh ofergittolnesse & nytenesse, þurh idelblisse & þurh unrotnesse worlde."
[000500 (14)],Peccaui per suauitatem mentis meae & per desiderium carnis.þurh wensumnesse mines modes & þurh gewilnunge flæsces.
[000600 (14)],"Peccaui per nocturnam pollutionem, per adulationem & simulationem, per malitiam & blasphemiam, per curiositatem & emulationem, per inobedientiam animi & indignationem, per inpatientiam & lasciuia ioca, per quinque sensus corporis mei uisum, auditum, gustum, odoratum & tactum, in cogitatione mala, in meditatione praua, in locutione peruersa, in actione pessima, in istis & in multis atque innumeris aliis causis peccauiþurh nihterne besmitenesse, þurh lyffetunge & þurh licetunge, þurh yfelnesse & þurh yfelsacunge, þurh carfulnesse & onherunge, þurh unhersumnesse modes & þurh æbilgðe, þurh unðolemodnesse & þurh galnesse gamenunga<../images/lbar.gif>galfullan spæce, mines lichaman, on gesihþe, on abiringe, on swecce & on æthryne, on yfele geþance, on þwerre smeaunge, on þwerre spræce, on werrestre dæde, on þisum & on manegum & on ungetelum ge oþrum intingan ic syngede."
[000700 (22)],Quarum ego numerum retinere nec recogitare nec etiam remunerare ualeo.þara ic ne mæg getel gehealden ne þencan ne eacswilce gemunan.
[000800 (23)],"Istarum denique & multarum aliarum, que uolens nolens aut sciens aut nesciens contra uoluntatem tuam, domine, feci & neglexi, tibi, domine, facio confessionem.þisra witodlice þe ic dede & ic forgemeleasede."
[000900 (25)],"Tu, pius & misericors, tribue mihi plenam misericorditer indulgentiam, qui uiuis & regnas, deus, per omnia secula seculorum."
